id_shopee;produto;preco;comissao_rs;vendas;nota;link_foto;link_afiliado;data_geracao;status;id_instagram
58251614409;"""Você está pronta para se sentir rainha? 🤴‍♀️😍 Descubra o ROMANTIC CROWN Copo Térmico Portátil 1200ml/600ml com Tampa e Canudo Garrafa Térmica Inoxidável À prova de vazamentos! 😍 Oferece confort e estilo para beber quente ou frio, onde for! 🏞️ E o melhor? Preço incrível R$ 39,98! 🤑 Comente EU QUERO que te envio o link! 💬""";39.98;3.20;11960;5;https://cf.shopee.com.br/file/br-11134207-81z1k-mi59t0ijd1ja72;https://s.shopee.com.br/AACS5lgmv1;2026-03-15 16:40:16;pendente;
22098878065;"""🎁👟 Presente incrível para o Dia dos Pais! 🤩 Chinelo Bandeirinha Original Sandalia De Dedo Unissex Verão, perfeito para o verão quente! 💦 R$ 19,9 é um preço irrisório para um presente tão incrível! 🚀 Comente EU QUERO que te envio o link! 💕""";19.9;2.79;10545;4.7;https://cf.shopee.com.br/file/sg-11134201-824hw-me1mqqajx1c73f;https://s.shopee.com.br/5fk2jUxv3A;2026-03-15 16:40:16;pendente;
22498420877;"""Treine em estilo com nosso Conjunto Fitness Feminina! 🏋️‍♀️✨ Para academias e treinos em casa, com bojo short roupa super confortável e preço incrível de R$ 79,9! 💸👉 Comente EU QUERO que te envio o link! 👇""";79.9;23.97;83;4.8;https://cf.shopee.com.br/file/br-11134207-81z1k-mhta63g3o5c2d2;https://s.shopee.com.br/900V7RY8bI;2026-03-15 22:56:15;pendente;
23694215749;💡🏠🍳 Acabou de chegar ao mercado o Conjunto Potes de Vidro com Tampa Bambu Cristal Porta Mantimentos Cozinha 3 Peças, perfeito para organizar sua cozinha! Agora você pode armazenar alimentos, condimentos e utensílios de forma limpa e acessível. Valor incrível: R$ 66,19! 🤑 Comente EU QUERO que te envio o link! 👉 #CozinhaEficiente #Organização #PotesDeVidro;66.19;8.60;216;4.9;https://cf.shopee.com.br/file/br-11134207-7r98o-malfycxrosr322;https://s.shopee.com.br/9AJvJkXVGL;2026-03-15 22:56:15;pendente;
23097292604;"""Kit de Ferramentas Completo com 46 peças de alta qualidade, incluindo soquetes, chaves de catraca reversível e mais! 🛠️💡 Agora por apenas R$ 28,99! 🤑 Não perca essa oportunidade incrível, é perfeito para qualquer projeto ou tarefa! 🎉 Comente EU QUERO que te envio o link! 📲""";28.99;2.32;2136;4.8;https://cf.shopee.com.br/file/br-11134207-7r98o-m5f9e6z081ad90;https://s.shopee.com.br/8fNeipZPHG;2026-03-15 22:56:15;pendente;
20999888733;"""Descubra a comodidade e o conforto dos seus sonhos com o Puff Opala - Kit 2 Poltrona! 🛋️ Com poltrona com amamentação e poltrona de apoio, você terá tudo o que precisa para a hora do aleitamento! 👶 E o melhor? Preço incrível de R$ 139! 🤑 Comente EU QUERO que te envio o link! 💬""";139;11.12;109;4.8;https://cf.shopee.com.br/file/br-11134207-81z1k-mf187dwarmdjd1;https://s.shopee.com.br/8ph4v8YlwJ;2026-03-15 22:56:15;pendente;
23398794668;"""🌴🧖‍♀️🛍️ Sente o calor da maciez! 🤩 Kit de 6 toalhas de banho grandes em 100% algodão premium, para você se sentir como em um resort! 🏖️💆‍♀️ R$ 67,9! 🤑 Comente EU QUERO que te envio o link! 💕""";67.9;10.86;2317;4.7;https://cf.shopee.com.br/file/sg-11134201-7reo2-mdumnv61jg0tf7;https://s.shopee.com.br/8KkoKDafxE;2026-03-15 22:56:15;pendente;
41178806100;"""Está procurando por uma blusa fresca e confortável para o verão? 💛 Compre nossa Blusa Feminina Brasil T-shirt de algodão, disponível por R$ 31,96! 🛍️ É o preço perfeito para uma peça que é ao mesmo tempo elegante e prática. 🌞 Comente EU QUERO que te envio o link! 👉""";31.96;15.34;22;5;https://cf.shopee.com.br/file/br-11134207-81zul-mku7d8k8n2f661;https://s.shopee.com.br/3LM9FCEVFw;2026-03-16 12:04:58;pendente;
23994308883;"""Mixe, cozinhe, processe e transforme seus alimentos com o Mixer Vertical Turbo 4 em 1, feito de inox de alta qualidade e com preço incrível de R$ 163,18! 🍲🍴👌 Comente EU QUERO que te envio o link! 👉""";163.18;66.90;164;5;https://cf.shopee.com.br/file/sg-11134201-7rdvx-mdgo5e37etsl76;https://s.shopee.com.br/3VfZRVDruz;2026-03-16 12:04:58;pendente;
58250495324;"""Transforme sua cozinha com o Jogo De Frigideira Rotoprint Antiaderente 3 Peças! 🍳🔥 Fácil limpeza, cozimento rápido e alimentos sem graxe. Preço incrível R$ 53.97! 🤑 Comente EU QUERO que te envio o link! 💬""";53.97;5.94;816;4.8;https://cf.shopee.com.br/file/sg-11134201-7reqe-m8hum901ty1z01;https://s.shopee.com.br/3fyzdoDEa2;2026-03-16 12:04:58;pendente;
26193950604;"""Viva o voo livre com o Xiaomi D16 Mini Drone 8K HD Câmera Dupla! 🚀📸 Com 180° de posicionamento GPS, evite obstáculos com facilidade, ajuste a velocidade e grava vídeos incríveis com a câmera dupla 8K! 💸 Por apenas R$ 135,13, você pode ter o controle total do céu! 🌌 Comente EU QUERO que te envio o link!""";135.13;20.27;2;5;https://cf.shopee.com.br/file/sg-11134201-81zw7-mj3wyfvyr6kke8;https://s.shopee.com.br/3qIPq7CbF5;2026-03-16 12:04:58;pendente;
58250670944;"""Descubra a perfeição em seu estilo de vida com essa jarra de vidro borossilicato com tampa de bambu 1,5L, ideal para sucos e água filtrada - um investimento de R$ 42.99 não pode faltar em sua cozinha! 🍹🌿 Comente EU QUERO que te envio o link! 💡""";42.99;9.89;152;4.9;https://cf.shopee.com.br/file/br-11134207-81z1k-mh5f4oacx3i89c;https://s.shopee.com.br/2g6SRyH2bs;2026-03-16 12:04:58;pendente;
22593193822;"""🚀 Acabou de encontrar o seu portão de vidro para sempre! 🌟 Porta Mantimento de Vidro Borossilicato Canelado, o vencedor da confiança, agora por apenas R$ 22,89! 🚫 Dura e resistente, protege a segurança e o bem-estar da sua família. 🏠 Compre agora e faça a diferença! 📲 Comente EU QUERO que te envio o link! 📲""";22.89;3.43;1193;4.9;https://cf.shopee.com.br/file/sg-11134201-7rdyi-mdqibwz8uokk13;https://s.shopee.com.br/2BACC18RV1;2026-03-16 17:10:16;pendente;
19799888316;"""Desodorante Body Splash Wepink VF Clássico, Obsessed e Infinity, 2ª réplica, 200ml, qualidade surpreendente, preço incrível R$ 37! 🚿💦👍 Comente EU QUERO que te envio o link! 💖""";37;8.51;0;4.7;https://cf.shopee.com.br/file/br-11134207-81z1k-mh6owpo5tekg87;https://s.shopee.com.br/8V4FjekKeG;2026-03-16 17:10:16;pendente;
22694663438;"""Cozinhe com mais segurança e eficiência com a Panela de Pressão Elétrica Digital 5 litros da Kian, disponível em preto ou inox por apenas R$ 319,90! 🍲🔥 Faça sua cozinha mais rápida e fácil! 🚀 Comente EU QUERO que te envio o link! 👉""";319.9;41.59;866;4.9;https://cf.shopee.com.br/file/br-11134207-81ztc-mk10g04dmv4317;https://s.shopee.com.br/8KkpXLkxzF;2026-03-16 17:10:16;pendente;
23293716378;"""Você está pronto para a aventura! 🚴‍♂️ Kit de bicicleta MTB com estrutura em aço e carbono, aro 29, freio a disco, e um tamanho ideal de 17. 🚀 Preço incrível: R$ 694,99! 🤑 Comente EU QUERO que te envio o link! 👉""";694.99;125.10;235;4.7;https://cf.shopee.com.br/file/br-11134207-81ztc-mk8h5qu4d7nl13;https://s.shopee.com.br/8ARPL2lbKE;2026-03-16 17:10:16;pendente;
20299603856;"""Elegância e confort para todos! 🏃‍♂️👟 Oferecemos tênis esportivos leves e confortáveis para corrida e caminhada, masculino e feminino, agora com preços impulsivos! 🚀 R$ 49,9 - Não perca essa oportunidade incrível! 🤩 Comente EU QUERO que te envio o link! 👇""";49.9;10.48;138;4.8;https://cf.shopee.com.br/file/br-11134207-81z1k-mepzreg55m2q11;https://s.shopee.com.br/807z8jmEfD;2026-03-16 17:10:16;pendente;
22093632236;"""Revolucione sua cozinha com o Kit Jogo de Cozinha Silicone, composto por utensílios e copo suporte para cozinheiro, perfeito para quem quer ser o MasterChef de casa! 🍳👨‍🍳 Com preço incrível de R$ 19,8, não perca a oportunidade de transformar sua cozinha em um local de criação e diversão! 📈 Comente EU QUERO que te envio o link! 👉""";19.8;1.98;120;4.7;https://cf.shopee.com.br/file/sg-11134201-7rfi7-m3p5b775a5hqae;https://s.shopee.com.br/2Vn2yVclXY;2026-03-16 22:57:59;pendente;
24740902631;💥 Desbloqueie o segredo dos ovos fritos perfeitos em qualquer lugar! 🍳👌 Cozinhador de ovos elétrico portátil, cozinha à vapor, 110V, cor aleatória, por apenas R$ 33.69! 🤑 Não perca a chance de cozinhar como um profissional em casa ou fora! 🏠🚀 Comente EU QUERO que te envio o link!;33.69;3.03;4849;4.8;https://cf.shopee.com.br/file/br-11134207-7r98o-mdg66onj1vipad;https://s.shopee.com.br/2LTcmCdOsX;2026-03-16 22:57:59;pendente;
21599849503;"""🔥 Oferecemos a você um conjunto feminino de luxo! 🙌 Colete e short elegante para você se sentir incrível em qualquer ocasião! 💃 Preço: R$ 59,4 🤑 É uma compra que você não pode perder! 🤩 Comente EU QUERO que te envio o link! 👉""";59.4;10.10;2976;4.7;https://cf.shopee.com.br/file/br-11134207-81z1k-mdxkdjjrpvr752;https://s.shopee.com.br/2BACZte2DW;2026-03-16 22:57:59;pendente;
23898739373;"""🔥💪 Descubra a Escova de Limpeza Elétrica 5 em 1, um multiuso sem fio para cozinha e banheiro que limpa diariamente e economiza tempo e esforço! 🚿💦 Com preço incrível de R$ 25,7, é a escolha perfeita para quem busca facilidade e eficiência! 🎉 Comente EU QUERO que te envio o link!""";25.7;3.34;921;4.7;https://cf.shopee.com.br/file/br-11134207-81ztc-mj5bxfrcl1qa14;https://s.shopee.com.br/20qmNaefYV;2026-03-16 22:57:59;pendente;
23799012678;"""Kit de Utensílios Para Cozinha em Silicone e Bambu 12 Peças: espátulas, colheres, garfos e mais! 🍳🌿 Não perca esta oportunidade de decorar sua cozinha com estilo e funcionalidade! 🏠👌 Oferecido a R$ 36,99, é uma excelente opção para quem busca uma cozinha mais sustentável e prática! 🌟 Comente EU QUERO que te envio o link! 💬""";36.99;4.81;283;4.6;https://cf.shopee.com.br/file/sg-11134201-824ic-mfr9c7tvpyx48e;https://s.shopee.com.br/8V4G7XFvMm;2026-03-16 22:57:59;pendente;
20797274812;"""Descubra a saúde perfeita com o Aparelho Medidor De Pressão Arterial De Braço Digital Inteligente-XHL HOME, fácil de usar, preciso e economico! Preço: R$ 36.8 💸👍 Comente EU QUERO que te envio o link! 📲""";36.8;3.68;4208;4.8;https://cf.shopee.com.br/file/br-11134207-7r98o-lqg5zj8w3zlv21;https://s.shopee.com.br/8ph7O6VUKT;2026-03-17 12:03:40;pendente;
22597120770;"""Acabe com os pós com nosso Robô Aspirador Inteligente Branco/Preto 🤖, que limpa automaticamente e tem um design compacto para qualquer espaço 🏠! Compre agora por apenas R$ 53,99 e aproveite a limpeza fácil e eficiente! 🚮👍 Comente EU QUERO que te envio o link! 👉""";53.99;7.56;2665;4.3;https://cf.shopee.com.br/file/br-11134207-81zts-mkzbwyejl14z7f;https://s.shopee.com.br/900XaPUqzW;2026-03-17 12:03:40;pendente;
56702965861;"""Obtenha o seu Porta Temperos Profissional Giratório de 9 potes vidro com tampa dosadora de condimentos no preço incrível de R$ 33,99! 🔥👉 Não perca essa promoção limitada! 🚨👉 Comente EU QUERO que te envio o link! 💻""";33.99;4.42;3481;4.9;https://cf.shopee.com.br/file/sg-11134201-822wt-mi55tcggdngn5f;https://s.shopee.com.br/9AJxmiUDeZ;2026-03-17 12:03:40;pendente;
22493620066;"""Lavadora de Alta Pressão Pistola Portátil Profissional Sem Fio Recarregável a Bateria Original Carro 💪🏽🔥, sem água quente, sem corda, sem limites! ✨, aproveite o preço incrível de R$ 109.99 🤑 e faça a limpeza mais fácil e eficaz da sua vida! 🙌 Comente EU QUERO que te envio o link!""";109.99;12.10;1445;4.7;https://cf.shopee.com.br/file/br-11134207-7r98o-m4g8xopn148xfe;https://s.shopee.com.br/9KdNz1TaJc;2026-03-17 12:03:40;pendente;
23094739178;"""Descubra a hidratação perfeita com o Kit com 3 Cremes Corporais Hidratantes Natura Tododia, cada um com 400ml! 🌿💦 Diversos benefícios para a pele, desde a hidratação até a proteção contra o sol ☀️! Oferecemos qualidade e preço incrível: R$ 27.99! 🤑 Comente EU QUERO que te envio o link! 👉""";27.99;3.64;0;3;https://cf.shopee.com.br/file/sg-11134201-81zvi-midl0v7oak1t42;https://s.shopee.com.br/9UwoBKSwyf;2026-03-17 12:03:40;pendente;
22197737647;"""Cobertor manta macio e macio para casal, tamanho 2,00x1,80, feito de microfibra liso estampado de alta qualidade! 🛏️💤 Oferece confort e calor em suas noites, e melhor ainda: apenas R$ 19,9! 🎁 Comente EU QUERO que te envio o link! 📲""";19.9;2.59;709;4.5;https://cf.shopee.com.br/file/sg-11134201-7rdxg-lz7ojy6tuzckb1;https://s.shopee.com.br/1gDxC2136L;2026-03-17 17:10:53;pendente;
20697874559;"""Desfrute do café da manhã perfeito com o kit Coala Home Chá Branco! 🍵☕️ Prepare o seu chá perfeito em casa com o kit completo que inclui chá, xícara e açúcar, tudo por apenas R$ 72,99! 🙌 Comente EU QUERO que te envio o link! 💚""";72.99;13.87;5698;5;https://cf.shopee.com.br/file/br-11134207-81ztr-ml2ht5dwxpmr20;https://s.shopee.com.br/1VuWzj1gRK;2026-03-17 17:10:53;pendente;
28484087175;"""Descubra a linha de cuidados pessoais Cuide-se Bem Nuvem de Alegria 🌸‍☁️: loção corporal iluminadora que faz você brilhar, body splash para uma sensação de frescura, óleo hidratante para a pele saudável, sabonete líquido para banho rejuvenescedor - tudo por apenas R$ 68,9! 🌸💖 Comente EU QUERO que te envio o link! 👉""";68.9;4.82;13;5;https://cf.shopee.com.br/file/br-11134207-7r98o-m8rtah0yqsjme2;https://s.shopee.com.br/1Lb6nQ2JmJ;2026-03-17 17:10:53;pendente;
22298078894;"""🍳👌 Encontre a perfeição na culinária com a nossa Porta Temperos Condimentos Giratório! 6 e 9 potes de vidro 90g com tampa dosadora preto + etiquetas adesivas, fácil de usar e limpar. R$ 29,90. 🎁 Comente EU QUERO que te envio o link!""";29.9;3.89;1241;4.9;https://cf.shopee.com.br/file/br-11134207-81ztc-mjivpwok153727;https://s.shopee.com.br/3qIRm0snho;2026-03-17 17:10:53;pendente;
58200981693;"""Descubra a saúde em um gole! 🍹🥛 Mini liquidificador portátil, 400ML, 6 lâminas, espremedor elétrico para sucos de frutas, legumes e leite. Ideal para smoothies saudáveis e leves! Preço incrível: R$ 36.99! 🚀 Comente EU QUERO que te envio o link! 👉""";36.99;4.44;2191;4.3;https://cf.shopee.com.br/file/sg-11134201-8225t-mhgsig1u016q21;https://s.shopee.com.br/3fz1ZhtR2n;2026-03-17 17:10:53;pendente;
23294184706;"""🛋️💡 Dê um toque de sofisticação à sua cama com o Conjunto de Cabeceiras em Módulos NÚVEM + Mesa de Cabeceira CLÉO com 1 Gaveta e Prateleira! 🌟 Cores incríveis e preço incrível: R$ 189,9! 🤑 Comente EU QUERO que te envio o link! 👉""";189.9;24.69;268;4.6;https://cf.shopee.com.br/file/br-11134207-7r98o-mbmfb2fi1pq00a;https://s.shopee.com.br/6VJDL08Zqu;2026-03-17 23:01:38;pendente;
23594303474;"""Acabou de chegar a chaleira elétrica inox 1,8L que está revolucionando a cozinha! Com potência de 1500W e design moderno, você pode cozinhar rapidamente e sem problemas. Preço incrível em R$ 65! 🍲💡🔥 Comente EU QUERO que te envio o link! 👉""";65;26.65;102;4.9;https://cf.shopee.com.br/file/sg-11134201-7rdy2-md6fnd5xeqqu72;https://s.shopee.com.br/6Kzn8h9DBt;2026-03-17 23:01:38;pendente;
19198262974;"""🚨 DESCONTIDO EXCLUSIVO! 🚨 Passadeira 110v Ferro a Vapor com Vaporizador de Roupas Tira Amasso Portátil de 800W, perfeito para limpar e desempenar as roupas com facilidade! 🤩 Rende seus investimentos em roupas e economize tempo com essa ferramenta essencial! 🛍️ R$ 69.99! Comente EU QUERO que te envio o link! 👉""";69.99;4.90;912;4.8;https://cf.shopee.com.br/file/sg-11134201-7ra14-mblim39p40p934;https://s.shopee.com.br/6AgMwO9qWs;2026-03-17 23:01:38;pendente;
21797514968;"""Acabou a busca pelo kit perfeito para sua manhã! 🌞👌 Xícara de café com 12 peças de cerâmica em porcelana de qualidade, perfeitas para um café da manhã em família ou para presentear! 🎁👫 Preço incrível: R$ 45,8! 🤑 Comente EU QUERO que te envio o link! """;45.8;1.37;830;4.8;https://cf.shopee.com.br/file/br-11134207-7r98o-m2885ktodu8651;https://s.shopee.com.br/60Mwk5ATrr;2026-03-17 23:01:38;pendente;
23098743173;"""Desbloqueie a limpeza perfeita em todo o seu lar com nossa Lixeira Sensor Automática Inteligente! 🚮🧹 Com capacidade de 16 litros e preço incrível de R$ 71,99, é a solução ideal para banheiro, cozinha e escritório. 🏠👍 Comente EU QUERO que te envio o link! 💻""";71.99;5.76;5780;4.9;https://cf.shopee.com.br/file/br-11134207-7r98o-mcjkoeu65udd4c;https://s.shopee.com.br/4LEil1GpFY;2026-03-17 23:01:38;pendente;
26991849556;"""Revolutize o seu banheiro com o Rack de armazenamento em alumínio dourado preto MEIDOO! 💫🛍️ Este item elegante e funcional vale a pena R$ 37,50! 🤑 Agora você pode organizar suas coisas com estilo e economizar espaço. 🏠👍 Comente EU QUERO que te envio o link! 😊""";37.5;3.38;335;4.9;https://cf.shopee.com.br/file/cn-11134207-820l4-meurxjnzqfi8c1;https://s.shopee.com.br/AKVwluHi21;2026-03-18 12:05:56;pendente;
22698805586;"""🚿🔥 Descubra o tapete de banheiro que revoluciona a limpeza! 💦 Tapete absorvente e antiderrapante que seca rapidamente 🚀 e é fácil de limpar! 🧹 Preço incrível de R$ 11,99! 🤑 Comente EU QUERO que te envio o link! 📲""";11.99;2.16;7432;4.8;https://cf.shopee.com.br/file/br-11134207-820ld-mlqasjn3pkp3e1;https://s.shopee.com.br/AACWZbILN0;2026-03-18 12:05:56;pendente;
23193407563;"""Acabou de encontrar a parafusadeira mais completa do mercado! 🚧🔩 Parafusadeira Furadeira 48V 2 Baterias + Maleta + Acessórios completo, tudo por apenas R$ 99,99! 🚨 Não perca essa oportunidade incrível! 🤩 Comente EU QUERO que te envio o link! 💥""";99.99;11.00;78;4.8;https://cf.shopee.com.br/file/br-11134207-7r98o-m106y9pfreou43;https://s.shopee.com.br/9zt6NIIyhz;2026-03-18 12:05:56;pendente;
23193934812;"""🚨 Oferecemos a melhor opção para suas viagens! 🌏 Bolsa Mala de Viagem Multifuncional de Grande Capacidade Resistente e Impermeável, ideal para guardar tudo e mais um pouco! 📦👍 Precisa? 💸 R$ 36,83! 🤑 Comente EU QUERO que te envio o link! 📲""";36.83;3.68;1670;4.9;https://cf.shopee.com.br/file/sg-11134201-7repv-m8zzi7nehlgn14;https://s.shopee.com.br/8V4IaXOgki;2026-03-18 12:05:56;pendente;
23497127686;"""Surpreenda sua pequena princesa com estes adoráveis kits de pijamas femininos! 🌸💖 Kit 3 Baby Doll Pijamas Femininos Conjuntos Short Doll Pijama Conjunto Feminino Original, apenas R$ 29,9! 🎁 Compre agora e faça a alegria de sua filha! 🎉 Comente EU QUERO que te envio o link! """;29.9;2.39;524;4.3;https://cf.shopee.com.br/file/br-11134207-81z1k-mfrd1ph2wdts41;https://s.shopee.com.br/8KksOEPK5h;2026-03-18 12:05:56;pendente;
21172775601;"""Transforme seu sofá em um estilo nórdico com a capa 1+2+3+4 lugares em forma de L, simplicidade e conforto garantidos! 🛋️ Toalha, slipcover, cobertor e almofada de pelúcia traseira incluídas! 💕 Preço incrível: R$ 78,06! Comente EU QUERO que te envio o link! 🔗""";78.06;10.93;8;4.2;https://cf.shopee.com.br/file/sg-11134201-22120-fhygcvnlr1kvc9;https://s.shopee.com.br/BPB08U0Na;2026-03-18 17:10:27;pendente;
22892865290;"""Imprima fotos de desenhos animados sem fio no seu Android ou iOS com esta mini impressora portátil por apenas R$ 47,95! 🖨️💻🎨👍 Comente EU QUERO que te envio o link! 👉""";47.95;5.75;680;4.9;https://cf.shopee.com.br/file/br-11134207-7r98o-lsaj0iwu4y78f0;https://s.shopee.com.br/15knpUdiZ;2026-03-18 17:10:27;pendente;
52905774499;"""Desbloqueie o poder da saúde natural em casa! 🍊🍋 Espremedor Elétrico de Frutas Automático para sucos naturais rápidos e deliciosos com design premium! 🌴 Laranja, Limão e outras frutas à vontade! 💦 Rápido, fácil e sem perda de nutrientes! 🌟 E mais: R$ 45,5! 🎁 Comente EU QUERO que te envio o link! 📲""";45.5;5.92;840;4.7;https://cf.shopee.com.br/file/sg-11134201-8260c-mlw5gdmlji8493;https://s.shopee.com.br/2Vn5mQL7e4;2026-03-18 17:10:27;pendente;
18468814604;"""Proteja suas janelas dos insetos e outros invasores com a Tela Mosqueteiro Janelas Magnético Anti Inseto Ajustável! 🐜🌟 Ajustável e fácil de instalar, essa tela magnética é o refúgio perfeito para manter seus ambientes limpos e frescos! 🌿👍 Preço incrível: R$ 48! 🤑 Comente EU QUERO que te envio o link! 👉""";48;6.24;1668;4.4;https://cf.shopee.com.br/file/sg-11134201-7rdxt-mdlb691y6wr91d;https://s.shopee.com.br/2LTfa7Lkz3;2026-03-18 17:10:27;pendente;
22594228907;"""🔥👀 Descubra o espelho Adnet Redondo com alça em couro costurado, perfeito para a sua sala, quarto ou banheiro 🏠🛏️! Com tamanho variável (30cm, 40cm ou 60cm) e suporte incluído, você vai se sentir como um rei (ou rainha) 👑! E o melhor? R$ 35,9! 🤑 Comente EU QUERO que te envio o link! 💬""";35.9;6.46;161;4.9;https://cf.shopee.com.br/file/br-11134207-81ztc-mk9uzvhoej29b0;https://s.shopee.com.br/2BAFNoMOK2;2026-03-18 17:10:27;pendente;
