п»ҝid_shopee;produto;preco;comissao_rs;vendas;nota;link_foto;link_afiliado;data_geracao;status;id_instagram
22594542431;"""LANГҮAMENTO! рҹҡҖ VocГӘ estГЎ preparado para a revoluГ§ГЈo? рҹӨҜ O novo iPhone 17 Pro / 17 Pro Max 256GB chegou! рҹ“ұ Com capacidade de armazenamento de 256GB e design inovador, essa Г© a oportunidade perfeita para atualizar seu smartphone! рҹ’» PreГ§o especial: R$ 8949 - O que vocГӘ espera para aproveitar? рҹӨ” Comente EU QUERO que te envio o link! рҹҳү""";8949;357.96;34;4.8;https://cf.shopee.com.br/file/br-11134207-81z1k-mhcaeeg33imda2;https://s.shopee.com.br/BQRCGBxNB;2026-05-06 17:46:36;pendente;
44759720970;"""Acabe com o frio da noite com o nosso cobertor manta casal em Sherpa, perfeito para o inverno! рҹҘ¶рҹ”Ҙ DuraГ§ГЈo de 2,10x1,90m, ideal para cama queen, e por apenas R$ 69,99! рҹҳҚ Quente, fofinho e econГҙmico, Г© o que vocГӘ precisa! рҹӣҸпёҸ Comente EU QUERO que te envio o link! рҹ’¬""";69.99;9.10;0;5;https://cf.shopee.com.br/file/br-11134207-820ly-mnomb9r6lyiqcc;https://s.shopee.com.br/LjrOZBK2E;2026-05-06 17:46:36;pendente;
57559008152;"""NГЈo perca a chance de conquistar a lenda! рҹ”Ҙ Compre o kit de 10/20/40 envelopes de 7 figurinhas Panini Oficial e tenha a chance de ganhar a lendГЎria Copa do Mundo 2026 Panini Oficial, todo por apenas R$ 79.99 рҹҺү Comente EU QUERO que te envio o link!""";79.99;5.60;0;5;https://cf.shopee.com.br/file/br-11134207-820md-mn5n90f1rfgh60;https://s.shopee.com.br/W3HasAghH;2026-05-06 17:46:36;pendente;
23093653150;"""рҹҺүрҹ”Ҡ Eleva a sua festa com a nossa Caixa de Som Grande Amplificada 2000w com Rodinha e 2 Microfones Sem Fio LED MP3! рҹ“Ҳ OfereГ§a uma experiГӘncia de som incrГӯvel para vocГӘ e seus amigos, sem gastar uma fortuna! рҹӨ‘ R$ 531,99 Г© um preГ§o incrГӯvel para uma caixa de som de alta qualidade! рҹҺҒ Comente EU QUERO que te envio o link!""";531.99;148.96;43;4.8;https://cf.shopee.com.br/file/sg-11134201-7ra36-m594p6s83fo736;https://s.shopee.com.br/gMhnBA3MK;2026-05-06 17:46:36;pendente;
58207428980;"""Cozinhe com facilidade e seguranГ§a com a Panela de PressГЈo ElГ©trica Digital 6 Litros da Kian! рҹҚІрҹ”Ҙ PreГ§o incrГӯvel de R$ 349,9! рҹӨ‘ Preto ou Inox, escolha a sua! рҹ’Ҝ Comente EU QUERO que te envio o link! рҹ‘ү""";349.9;90.97;38;4.8;https://cf.shopee.com.br/file/br-11134207-820ls-mm67ryd9ih3b2d;https://s.shopee.com.br/qg7zU9Q1N;2026-05-06 17:46:36;pendente;
22199186045;"""Organize seu congelador com estilo e seguranГ§a com o Kit 10 Marmita! рҹҘҳрҹ‘Ң Potes de 750ml com travas laterais BPA FREE, prГЎticos e sustentГЎveis! рҹҢҺ PreГ§o incrГӯvel: R$ 21,9! рҹҳҚ Comente EU QUERO que te envio o link! рҹ‘Ү""";21.9;3.94;10499;4.1;https://cf.shopee.com.br/file/br-11134207-820ld-mn0gastl9szkd6;https://s.shopee.com.br/AUqdsgMsPy;2026-05-06 23:27:49;pendente;
21099552315;"""Descubra a mГәsica sem limites com o Fone de Ouvido Bluetooth M47! рҹҺ§рҹ”Ҙ Com qualidade de ГЎudio alta e conexГЈo sem fio, vocГӘ poderГЎ curtir suas mГәsicas favoritas sem ser pego pelas cordas! рҹҡ«рҹ‘Ӯ E tudo isso por apenas R$ 49,9! рҹ’ё Comente EU QUERO que te envio o link! рҹ“І""";49.9;5.99;2999;4.8;https://cf.shopee.com.br/file/br-11134207-7r98o-m2dgumrr891y18;https://s.shopee.com.br/AKXDgNNVkx;2026-05-06 23:27:49;pendente;
21099558142;"""рҹҡЁ Oferecemos a maior conveniГӘncia no seu dia a dia! рҹ”Ҙ Secadora de Roupas PortГЎtil 110v e 220v, com tecnologia eficiente e design compacto, agora por apenas R$ 190! рҹҡҖ Comente EU QUERO que te envio o link!""";190;24.70;19;4.8;https://cf.shopee.com.br/file/sg-11134201-7renj-m2k61k3eaxme3d;https://s.shopee.com.br/9Uy6gqQgRo;2026-05-06 23:27:49;pendente;
18598167463;рҹҺүрҹ‘Қ Oferecemos o Kit Teclado e Mouse Sem Fio Tablet Celular Bluetooth PortГЎtil, compatГӯvel com Android, iOS e Windows! рҹ“ұрҹ’» Conecte-se com facilidade e aumente sua produtividade com este kit acessГӯvel! рҹӨ‘ PreГ§o: R$ 39,9 (sim, vocГӘ leu certo!) рҹӨҜ Comente EU QUERO que te envio o link!;39.9;8.38;549;4.8;https://cf.shopee.com.br/file/br-11134207-7r98o-m8zgieqwb22h93;https://s.shopee.com.br/9KegUXRJmn;2026-05-06 23:27:49;pendente;
23694215749;"""Revitalize sua cozinha com estilo e funcionalidade рҹҚірҹҸ ! Conjunto de 3 potes de vidro com tampa bambu cristal para organizar seus mantimentos рҹ“Ұ e dar um toque de elegГўncia ao seu espaГ§o culinГЎrio рҹҚҙ! PreГ§o irresistГӯvel: R$ 66,19 рҹӨ‘! Comente EU QUERO que te envio o link! рҹ’¬""";66.19;8.60;278;4.9;https://cf.shopee.com.br/file/br-11134207-7r98o-malfycxrosr322;https://s.shopee.com.br/9pax5SPPlu;2026-05-06 23:27:49;pendente;
23294633928;"""Descubra o conforto perfeito com as nossas toalhas de banho e rosto de 100% algodГЈo, macias e absorventes, ideais para quem busca uma experiГӘncia de banho rГЎpida e agradГЎvel! рҹ§–вҖҚвҷҖпёҸрҹ’Ұ PreГ§o incrГӯvel de R$ 24,9! рҹҺҒ Comente EU QUERO que te envio o link! рҹ‘ү""";24.9;1.99;1534;3.9;https://cf.shopee.com.br/file/br-11134207-820la-mmhjbk96rcw71e;https://s.shopee.com.br/7VD3E0kKe1;2026-05-07 13:15:30;pendente;
23398041548;"""Kit Presente рҹ’• para quem ama a arte! OfereГ§a um sorriso a alguГ©m especial com essas 04 canecas e 04 xГӯcaras de coraГ§Гөes adorГЎveis рҹ’—, apenas por R$ 25,99! рҹӣҚпёҸрҹ‘ү Comente EU QUERO que te envio o link! рҹҳҠ""";25.99;3.38;28;4.6;https://cf.shopee.com.br/file/br-11134207-7r98o-m7b2itrypbuyda;https://s.shopee.com.br/7fWTQJjhJ4;2026-05-07 13:15:30;pendente;
41178806100;"""рҹҳҚ Encontre a perfeiГ§ГЈo para o verГЈo com a nossa Blusa Feminina Brasil T-shirt, feita de algodГЈo macio e confortГЎvel, perfeita para dias quentes e longas caminhadas! рҹҢһ PreГ§o incrГӯvel de R$ 31.96! рҹҳҠ Comente EU QUERO que te envio o link! рҹ‘ү""";31.96;8.95;1955;4.7;https://cf.shopee.com.br/file/br-11134207-81zul-mku7d8k8n2f661;https://s.shopee.com.br/7pptccj3y7;2026-05-07 13:15:30;pendente;
58256796048;"""Descubra o segredo para uma pele radiante e irresistГӯvel com o Body Splash Deleite do BoticГЎrio! рҹҢёрҹ’Ұ Um aroma divino em um preГ§o incrГӯvel, R$ 19,99! рҹ’ё NГЈo perca a oportunidade de deixar sua pele brilhante e atraente! Comente EU QUERO que te envio o link! рҹ‘ү""";19.99;2.60;23;4;https://cf.shopee.com.br/file/br-11134207-820lt-mlqeirkqq7sw92;https://s.shopee.com.br/6fdwETnVKu;2026-05-07 13:15:30;pendente;
22799378163;"""Vamos ao campo! рҹҸҹпёҸ Compre agora o Bandeirinha Verde E Amarela Copa Mundo Brasil PlГЎstico, perfeito para os fГЈs do futebol! рҹҸҶ PreГ§o especial de R$ 12,99! рҹҺү Futebol, coraГ§ГЈo e orgulho brasileiro, tudo em uma Гәnica bandeira! рҹҮ§рҹҮ· Comente EU QUERO que te envio o link! рҹ“І""";12.99;1.69;491;4.9;https://cf.shopee.com.br/file/sg-11134201-8261j-mlxg8rakoc9431;https://s.shopee.com.br/6pxMQmmrzx;2026-05-07 13:15:30;pendente;
58251509606;"""Organize sua casa de forma eficiente com esse carrinho de multiuso! вңЁ ArmГЎrio, carrinho de brinquedos, roupas, multiuso, acessГіrios para banheiro, lavanderia, cozinha e quartos! рҹҸ рҹ’Ә Fique mais organizado e tranquilo! рҹҷҸ PreГ§o incrГӯvel de R$ 132,60! рҹӨ‘ Comente EU QUERO que te envio o link!""";132.6;3.98;40;4.9;https://cf.shopee.com.br/file/br-11134207-81z1k-mhv0drx6sbnqe7;https://s.shopee.com.br/3LNUZSr35O;2026-05-07 17:53:47;pendente;
22392896442;"""Desbloqueie o estilo em casa com o Jogo TaГ§as Vidro 340Ml Diamond Bico Jaca Abacaxi! рҹҚёрҹ‘Қ Este conjunto de 4 taГ§as de vidro resistentes e elegantes Г© perfeito para ГЎgua, vinho tinto, suco e mais! рҹҚ№рҹ‘Ң E o melhor, Г© acessГӯvel a apenas R$14,90! рҹӨ‘ Comente EU QUERO que te envio o link! рҹ’¬""";14.9;1.94;570;4.9;https://cf.shopee.com.br/file/br-11134207-81ztz-ml3pi3snkyrl46;https://s.shopee.com.br/3VgullqPkR;2026-05-07 17:53:47;pendente;
40978475875;"""Corra mais rГЎpido e em estilo com a nossa nova placa de carbono profissional! рҹҸғвҖҚвҷӮпёҸрҹ‘ҹ ConheГ§a o nosso tГӘnis de corrida de moda para homens e mulheres, tamanho 33-44, com tecnologia de ponta e design inovador, disponГӯvel por apenas R$ 79,96! рҹӨҜ Comente EU QUERO que te envio o link! рҹ‘ү""";79.96;7.20;2186;4.8;https://cf.shopee.com.br/file/sg-11134201-8261o-mjyfg9rs969s85;https://s.shopee.com.br/30keAqsJlM;2026-05-07 17:53:47;pendente;
43628800869;"""AqueГ§a sua primavera com estilo! рҹҢһрҹ‘• Kit Moletom Brasil Unissex Casaco Flanelado AlgodГЈo Premium, perfeito para os dias mais frios, em preto sГі! рҹ–Ө PreГ§o incrГӯvel de R$ 71,96 рҹӨ‘! Comente EU QUERO que te envio o link! рҹ“І""";71.96;34.54;18;4.4;https://cf.shopee.com.br/file/br-11134207-81zu3-mktrr54ipds30b;https://s.shopee.com.br/3B44N9rgQP;2026-05-07 17:53:47;pendente;
22093632236;"""Cozinhe com estilo e facilidade com o Kit Jogo de Cozinha Silicone, UtensГӯlios e Copo Suporte para Cozinheiro Cabo de Madeira MasterChef! рҹҚірҹ‘ЁвҖҚрҹҚі Agora por apenas R$ 19,8 vocГӘ pode ter todo o necessГЎrio para preparar deliciosas refeiГ§Гөes. рҹҚҙ Comente EU QUERO que te envio o link! рҹ‘ү""";19.8;1.98;63;4.7;https://cf.shopee.com.br/file/sg-11134201-7rfi7-m3p5b775a5hqae;https://s.shopee.com.br/2g7nmEtaRK;2026-05-07 17:53:47;pendente;
22794249795;"""рҹ’§рҹӣҚпёҸ PeГ§a agora! рҹ”Ҙ Gabinete Coluna para Pia de banheiro 1 Porta e com Prateleira Organizadora Branco Ripado por apenas R$ 146.99! рҹҡЁ Organize seu banheiro com estilo e economia! рҹҷҢ Comente EU QUERO que te envio o link! рҹ‘ү""";146.99;10.29;86;4.9;https://cf.shopee.com.br/file/br-11134207-7r98o-mcladqngprn6f4;https://s.shopee.com.br/9Kei5Ra9XN;2026-05-07 23:28:03;pendente;
22493620066;"""Economize tempo e esforГ§o com a nossa lavadora de alta pressГЈo portГЎtil profissional! рҹ’§рҹ’Ә Sem fio e recarregГЎvel a bateria original, vocГӘ estarГЎ pronto para qualquer limpeza em apenas R$ 136,99! рҹҡҖ Comente EU QUERO que te envio o link!""";136.99;9.59;2191;4.7;https://cf.shopee.com.br/file/br-11134207-7r98o-m4g8xopn148xfe;https://s.shopee.com.br/9paygMYFWU;2026-05-07 23:28:03;pendente;
58203349505;"""рҹҚ–рҹ§Җ Organize sua geladeira com estilo e economize espaГ§o com essa porta fria dupla preta para presunto e queijo com fundo removГӯvel! рҹҡ« Conserva frescura e evita vazamentos com seguranГ§a hermГ©tica, tudo por apenas R$ 17.89! рҹӨ‘ Comente EU QUERO que te envio o link! рҹ’¬""";17.89;2.33;3441;4.6;https://cf.shopee.com.br/file/br-11134207-820l9-ml6ctmoc7ojo37;https://s.shopee.com.br/9fHYU3YsrT;2026-05-07 23:28:03;pendente;
25592118043;"""Respire com facilidade рҹҢҹ! O nosso inalador nebulizador portГЎtil ultrassГҙnico atomizador de baixo nГӯvel Г© perfeito para crianГ§as e adultos, ajudando a aliviar sintomas de asma e outras condiГ§Гөes respiratГіrias рҹӨ•, com preГ§o incrГӯvel de R$ 19,99! Comente EU QUERO que te envio o link! рҹ“І""";19.99;1.40;4749;4.8;https://cf.shopee.com.br/file/cn-11134207-7ras8-m6z2ej03lqdva9;https://s.shopee.com.br/AADp4yWyqa;2026-05-07 23:28:03;pendente;
23294184706;вңЁ Acaba de chegar! рҹҺү Conjunto de Cabeceiras em MГіdulos NГҡVEM com 1 kit Mesa de Cabeceira CLГүO com 1 Gaveta e Prateleira рҹӣ пёҸ - Cores: vГЎrias opГ§Гөes disponГӯveis рҹ’Ў - PreГ§o incrГӯvel: R$ 189,9 рҹ”Ҙ рҹӣҚпёҸ Comente EU QUERO que te envio o link!;189.9;24.69;162;4.7;https://cf.shopee.com.br/file/br-11134207-7r98o-mbmfb2fi1pq00a;https://s.shopee.com.br/9zuOsfXcBZ;2026-05-07 23:28:03;pendente;
20797274812;"""Descubra a sua pressГЈo arterial em casa com o Aparelho Medidor De PressГЈo Arterial De BraГ§o Digital Inteligente-XHL HOME! рҹҸўрҹ’Ҡ Precisamos apenas de 3 minutos para obter um resultado preciso e detalhado. NГЈo perca mais tempo em consultas mГ©dicas! рҹ•’пёҸ Valor incrГӯvel de R$ 35,8! вҡ–пёҸ Comente EU QUERO que te envio o link! рҹ’»""";35.8;3.22;1195;4.8;https://cf.shopee.com.br/file/br-11134207-7r98o-lqg5zj8w3zlv21;https://s.shopee.com.br/9KeiynS5Lc;2026-05-08 12:54:03;pendente;
22298078894;"""Descubra a praticidade e a organizaГ§ГЈo com a nossa porta temperos giratГіrio 6 e 9 potes vidro de 90g, com tampa dosadora e etiquetas adesivas! рҹ”ҘвңЁпёҸ Agora vocГӘ pode armazenar e acessar facilmente seus condimentos favoritos sem ocupar muito espaГ§o! рҹҚІрҹ‘Ң PreГ§o incrГӯvel: R$ 33,99! рҹ’° Comente EU QUERO que te envio o link!""";33.99;4.42;1078;4.9;https://cf.shopee.com.br/file/br-11134207-81ztc-mjivpwok153727;https://s.shopee.com.br/9Uy9B6RS0f;2026-05-08 12:54:03;pendente;
23698384152;"""Melhore sua condicionamento fГӯsico com nossa bicicleta ergomГ©trica de alta qualidade, projetada para academias e profissionais, suporta atГ© 120kg! рҹ”Ҙрҹ’Ә Ganhe mГәsculos, perca gordura e aumente sua resistГӘncia com nosso equipamento de spinning de Гәltima geraГ§ГЈo, aproveite nossas promoГ§Гөes e compre agora por R$779! рҹҡҙвҖҚвҷҖпёҸрҹ’ё Comente EU QUERO que te envio o link! рҹ‘ү""";779;85.69;1417;4.8;https://cf.shopee.com.br/file/br-11134207-7r98o-m8dq90menppta0;https://s.shopee.com.br/9fHZNPQofi;2026-05-08 12:54:03;pendente;
58252307751;"""Transforme seu espaГ§o em um santuГЎrio de luxo com o nosso Lustre de Teto LED em 3 cores! рҹҢғрҹ’Ў Ajuste para 110V ou 220V, perfeito para sala de jantar e estar romГўntico. Estilo escandinavo, sofisticaГ§ГЈo garantida! рҹҸ рҹ’• PreГ§o incrГӯvel R$ 145,99! рҹ’ё Comente EU QUERO que te envio o link! рҹ“І""";145.99;16.06;208;4.8;https://cf.shopee.com.br/file/br-11134207-81z1k-mik0biywledfa0;https://s.shopee.com.br/9pazZiQBKl;2026-05-08 12:54:03;pendente;
43308653347;"""Descubra a tecnologia do futuro em sua sala! рҹҳ® Smart TV 32 polegadas LED HD Wi-Fi com 60Hz, Android 14 e Wi-Fi! рҹ‘Қ Conecte-se Г  internet e aproveite streaming, jogos e muito mais! рҹ“ә PreГ§o incrГӯvel: R$ 890! рҹӨ‘ NГЈo perca essa oportunidade! Comente EU QUERO que te envio o link! рҹ’»""";890;44.50;870;4.8;https://cf.shopee.com.br/file/cn-11134207-7ras8-mcpxy3beiwrt0d;https://s.shopee.com.br/9zuPm1PXzo;2026-05-08 12:54:03;pendente;
27204922454;"""рҹ’Ў Descubra o segredo para carregar seu celular em qualquer lugar! рҹ”Ң Painel solar de 2W Г  prova d'ГЎgua, perfeito para caminhadas ao ar livre e acampamento, por apenas R$ 25,18! рҹҸһпёҸ Comente EU QUERO que te envio o link! рҹ‘ү""";25.18;2.01;35;4.5;https://cf.shopee.com.br/file/sg-11134201-7rdyo-lxiluidyvudi73;https://s.shopee.com.br/BQUMaDRTW;2026-05-08 17:25:23;pendente;
22494777696;"""Viva o Brasil! рҹҮ§рҹҮ· Compre agora a nossa Blusa Moletom do Brasil, disponГӯvel para homens e mulheres! рҹӨ© Um estilo unissex para todos os fГЈs, com preГ§o incrГӯvel de R$ 64,88! рҹӨ‘ NГЈo perca a oportunidade de mostrar sua paixГЈo pelo Brasil! рҹҺү Comente EU QUERO que te envio o link! рҹ’•""";64.88;8.43;43;4.7;https://cf.shopee.com.br/file/sg-11134201-81zv5-mj2z2ezgjwn94e;https://s.shopee.com.br/174AHE4oV;2026-05-08 17:25:23;pendente;
13590189810;"""OfereГ§a o melhor cuidado para vocГӘ e seu bebГӘ com a Linha MamГЈe e BebГӘ Natura do @Natura: Shampoo, Condicionador, Sabonete LГӯquido/Barra, Saboneteira ou LenГ§os Umedecidos, por apenas R$ 27,9! рҹҢёрҹ’–рҹ’§ NГЈo perca essa oportunidade de cuidar da pele sensГӯvel do seu bebГӘ e se sentir confiante com a linha natural e biodegradГЎvel da Natura. Comente EU QUERO que te envio o link!""";27.9;1.95;69;4.9;https://cf.shopee.com.br/file/br-11134207-7r98o-mcn4jea5dtmaf3;https://s.shopee.com.br/1BJ1YQ9dRk;2026-05-08 17:25:23;pendente;
22197737647;"""Acabou a procura pelo cobertor perfeito para o casal! рҹӨ© Descubra a nossa Manta Casal Macio Microfibra Liso Estampado, com medidas 2m x 1,80m para o casal ou PET 0,90cm x 0,80cm para individual! рҹӣҸпёҸ Conforte e estГ©tica garantidos por apenas R$ 19,9! рҹҡҖ Comente EU QUERO que te envio o link!""";19.9;2.59;3900;4.4;https://cf.shopee.com.br/file/br-11134207-820l6-mnlshstv8cg476;https://s.shopee.com.br/10zbM7AGmj;2026-05-08 17:25:23;pendente;
22994353072;"""Transforme sua cozinha com o Kit de 10 Potes de Vidro Retangular HermГ©tico 640ml Marmita! рҹҚІрҹ‘ЁвҖҚрҹҚі AlГ©m de ser prГЎtico e estiloso, Г© tambГ©m seguro e duradouro! рҹ’Ҝ O melhor ainda? Fica por apenas R$ 114,9! рҹӨ‘ Comente EU QUERO que te envio o link! рҹ‘ү""";114.9;8.04;199;4.9;https://cf.shopee.com.br/file/sg-11134201-824gu-mdxlz1ecm0hs29;https://s.shopee.com.br/qgB9oAu7i;2026-05-08 17:25:23;pendente;
58209990683;"""Obtenha a capa original do Album Capa Mole Brochura Figurinhas Copa Do Mundo FIFA 2026 Panini! рҹҸҶрҹ“ҡрҹ‘Қ PreГ§o exclusivo: R$ 57,9! рҹҺҒ Vai ser o seu maior tesouro! Comente EU QUERO que te envio o link! рҹ‘ү""";57.9;17.95;43;5;https://cf.shopee.com.br/file/br-11134207-820m3-mnt9ebynev4246;https://s.shopee.com.br/9fHa53X79X;2026-05-08 23:29:37;pendente;
22594910148;"""Transforme sua cozinha com esta dupla de produtos incrГӯveis! рҹҚірҹҚҙ Fritadeira elГ©trica sem Гіleo Air Fryer AFN40BI 4L + Liquidificador Turbo Power L-99 FB 500W Mondial, perfeita para fazer refeiГ§Гөes saudГЎveis e deliciosas em casa! рҹҚІрҹ‘Ң PreГ§o incrГӯvel de R$ 397,95! рҹҳҚ Comente EU QUERO que te envio o link! рҹ’Ҙ""";397.95;43.77;74;4.9;https://cf.shopee.com.br/file/sg-11134201-8261l-mm9annexmlmwc3;https://s.shopee.com.br/AADqfyVD8e;2026-05-08 23:29:37;pendente;
22697842292;"""Lavagem profissional em casa! рҹҡ—рҹ’Ұ OfereГ§a aos seus carros um brilho de fГЎbrica com nosso pulverizador de alta pressГЈo com garrafa de espuma, por apenas R$ 35! рҹ’ёвңЁ Comente EU QUERO que te envio o link!""";35;3.15;231;4.7;https://cf.shopee.com.br/file/br-11134207-81z1k-mgpdn0bmptl02f;https://s.shopee.com.br/9zuQTfVqTd;2026-05-08 23:29:37;pendente;
58209882446;"""Prepare-se para a grande festa do futebol com o Kit Inicial ГҒlbum Copa do Mundo 2026 + 5 Envelopes Panini! рҹҸҶрҹ“ҡрҹҺү Compre agora por apenas R$ 69 e fique por dentro da emoГ§ГЈo, coletando e organizando suas cartas favoritas! рҹӨ© Comente EU QUERO que te envio o link! рҹ‘ү""";69;12.42;24;5;https://cf.shopee.com.br/file/sg-11134201-820mn-mnnl3hrbl151f2;https://s.shopee.com.br/AUqh4aTwSk;2026-05-08 23:29:37;pendente;
58206988710;"""рҹ”Ҙрҹ’Ё Acaba a busca por um moletom perfeito! рҹҺү Oferecido no preГ§os incrГӯvel de R$ 64,94, o Moletom Canguru Unissex Premium Г© o escolha certa! рҹ‘– Forrado para durar, bolso canguru para acomodar tudo e costura reforГ§ada para garantir o conforto! рҹӨ© Comente EU QUERO que te envio o link! рҹ‘ү #moletomcanguru #unissex #premiumpromocao""";64.94;11.04;332;4.7;https://cf.shopee.com.br/file/br-11134207-820mf-mlss5z4lrton7c;https://s.shopee.com.br/AKXGsHUZnj;2026-05-08 23:29:37;pendente;
26991849556;"""рҹҡҝрҹ”Ҙ OfereГ§a um banheiro de sonho com o Rack de armazenamento em alumГӯnio dourado preto MEIDOO! рҹҢҹ Ideal para guardar produtos de higiene, perfumes e mais! рҹ§–вҖҚвҷҖпёҸ PreГ§o incrГӯvel de R$ 37,5! рҹӨ‘ Comente EU QUERO que te envio o link! рҹ’»""";37.5;3.38;239;4.9;https://cf.shopee.com.br/file/cn-11134207-820l4-meurxjnzqfi8c1;https://s.shopee.com.br/9zuRJvd7Xo;2026-05-09 12:10:36;pendente;
23698870541;"""CafГ© da manhГЈ em casa com estilo! рҹҢһвҳ•пёҸ Descubra o copo tГ©rmico super fofa com estampa de coraГ§Гөes em aГ§o inox antivazamento! рҹ’• 420ml / 1200ml com canudo e tampa com laГ§o. PreГ§o incrГӯvel: R$ 42,99! рҹӨ‘ Comente EU QUERO que te envio o link! рҹ‘Ү""";42.99;5.59;119;4.9;https://cf.shopee.com.br/file/br-11134207-81z1k-me7p9ucc0x6q6e;https://s.shopee.com.br/AADrWEcUCr;2026-05-09 12:10:36;pendente;
22094689187;"""рҹҚ…рҹҘ—рҹҚҢ Descubra o Fatiador Ralador 16 em 1 Profissional de Cozinha em AГ§o InoxidГЎvel Multifuncional para Legumes Frutas e Verduras! рҹӨ© Agora, vocГӘ pode fatiar, ralar, cortar e mais 14 funГ§Гөes em 1! рҹҢҹ PreГ§o incrГӯvel: R$38.98! рҹӨ‘ Comente EU QUERO que te envio o link!""";38.98;4.68;4698;4.8;https://cf.shopee.com.br/file/br-11134207-81ztc-mjqenullkow37c;https://s.shopee.com.br/AKXHiXbqru;2026-05-09 12:10:36;pendente;
23991092116;"""NГЈo perca essa chance de ter um conforto total no seu dia a dia! рҹӣ пёҸрҹ‘ҹ Oferecemos a Bota Botina Masculina Jequinha, com preГ§os incrГӯveis! рҹҡҖ Aproveite a promoГ§ГЈo e compre agora mesmo por apenas R$ 29.89! рҹ’ё VocГӘ ainda nГЈo quer saber mais sobre ele? Comente EU QUERO que te envio o link! рҹҳү""";29.89;5.68;35;4.9;https://cf.shopee.com.br/file/br-11134207-81ztk-mkwcrpvo2ghvae;https://s.shopee.com.br/AUqhuqbDWx;2026-05-09 12:10:36;pendente;
53402241742;"""VocГӘ estГЎ procurando por um body para o seu bebГӘ que seja autГӘntico e patriotico? рҹҮ§рҹҮ· EntГЈo Г© hora de escolher o Body BebГӘ Copa Brasil - Menino Menina! рҹҺү Com cor verde e amarelo, ele Г© perfeito para o seu pequeno brasileiro. рҹҷҢ E o melhor? Ele Г© muito acessГӯvel! рҹӨ‘ PreГ§o: R$ 22,66. рҹ“Ұ Comente EU QUERO que te envio o link! рҹ‘ү""";22.66;3.40;6;5;https://cf.shopee.com.br/file/br-11134207-81ztc-mjdiz80id9mq46;https://s.shopee.com.br/809MwFkjbU;2026-05-09 12:10:36;pendente;
40480210628;"""VocГӘ estГЎ preparado para a Copa do Mundo? рҹҢҺ Colecionador, nГЈo perca essa oportunidade! рҹҺү Album oficial Panini com capa mole + 14 figurinhas oficiais para completar sua coleГ§ГЈo! рҹ“ҡ PreГ§o incrГӯvel R$ 77,97! рҹ’ё Comente EU QUERO que te envio o link! рҹ“І""";77.97;8.58;23;4.6;https://cf.shopee.com.br/file/sg-11134201-81zwr-mn9fbtno543n09;https://s.shopee.com.br/4fsvI6lN4V;2026-05-09 17:01:33;pendente;
58255074425;"""Desbloqueie seu metabolismo com o nosso suplemento alimentar original! Quitosana + Spirulina + Psyllium + Fibra de ChicГіria + CafГ© Verde 600mg em apenas 1 dose. Perda de peso, energia e saГәde Гіptima em R$ 21,9! Comente EU QUERO e eu te envio o link! рҹҳү""";21.9;4.16;2350;4.9;https://cf.shopee.com.br/file/br-11134207-820lx-mlqh3vaway9y38;https://s.shopee.com.br/4VZV5nm0PU;2026-05-09 17:01:33;pendente;
53706260170;"""Vamos para o campo! рҹҸҸрҹҗ¶рҹҗұ OfereГ§a ao seu time de estimaГ§ГЈo a comodidade e o estilo com essa roupa camiseta regata Brasil para pet, perfeita para jogos de futebol, Copa Azul Amarela! рҹҢҹ ConfortГЎvel, versГЎtil e preГ§o incrГӯvel: R$ 24.99! рҹӨ‘ Comente EU QUERO que te envio o link! рҹ’¬""";24.99;3.25;117;4.9;https://cf.shopee.com.br/file/sg-11134201-8260i-mktzuztwx5vla1;https://s.shopee.com.br/4LG4tUmdkT;2026-05-09 17:01:33;pendente;
23893381630;"""Bolsa de Ombro para Pet рҹҗ¶рҹҗұ Transversal ConfortГЎvel e PrГЎtica para Transporte de Animais! рҹҡҖ Proteja e transporte seu cachorro ou gato com estilo e comodidade! рҹҸӢпёҸвҖҚвҷҖпёҸ PreГ§o incrГӯvel: R$ 37,53! рҹӨ‘ Comente EU QUERO que te envio o link! рҹ’»""";37.53;3.00;252;4.9;https://cf.shopee.com.br/file/br-11134207-7r98o-ma98bkimlzll29;https://s.shopee.com.br/4AwehBnH5S;2026-05-09 17:01:33;pendente;
23798287452;"""рҹҺҒрҹ‘  Dia das MГЈes Г© aqui! ConheГ§a nossa bota feminina com fivela removГӯvel, cano curto e ziper, perfeito para dar um salto em alta no estilo! PreГ§o incrГӯvel de R$ 99,9! рҹӣҚпёҸрҹ‘— Comente EU QUERO que te envio o link! рҹ‘ү""";99.9;6.99;430;4.9;https://cf.shopee.com.br/file/br-11134207-7r98o-m8ndayh1dvv592;https://s.shopee.com.br/40dEUsnuQR;2026-05-09 17:01:33;pendente;
23497464266;"""рҹҡЁ Organize seus mantimentos de forma elegante e segura com este conjunto de 5 potes hermГ©ticos em acrГӯlico cristal com trava e design empilhГЎvel! рҹ’јрҹ“Ұ PreГ§o incrГӯvel de R$ 78,33! рҹӨ‘ NГЈo perca esse opportunity, Comente EU QUERO que te envio o link!""";78.33;14.10;16;4.5;https://cf.shopee.com.br/file/br-11134207-7r98o-lyrwrq76add1b9;https://s.shopee.com.br/20sAXY8Pl4;2026-05-09 23:25:08;pendente;
22691642487;"""Surpreenda a sua mГЈe especial com o Kit Presente Perfeito para Dia Das MГЈes: Almofada macia e caneca personalizГЎvel com lembrancinha adorГЎvel! рҹҺҒрҹ‘өрҹҸјрҹҳҚ PreГ§o incrГӯvel: R$ 28,24! рҹӨ© Comente EU QUERO que te envio o link! рҹ‘Ү""";28.24;3.11;805;4.6;https://cf.shopee.com.br/file/br-11134207-820ma-mlrr7avmckcg4b;https://s.shopee.com.br/2BBajr7mQ7;2026-05-09 23:25:08;pendente;
20697752160;"""Descubra o segredo para organizar seu guarda-roupa em 30 segundos! рҹ•’рҹ‘  A Sapateira Rubi 2 Portas com Espelho e 1 Gaveta, perfeito para 15 pares de sapato, Г© a soluГ§ГЈo que vocГӘ sempre precisou! рҹӨ© PreГ§o incrГӯvel R$ 604,24! рҹӨ‘ Comente EU QUERO que te envio o link! рҹ’¬""";604.24;42.30;364;4.7;https://cf.shopee.com.br/file/sg-11134201-7rdya-lxjungxziefze8;https://s.shopee.com.br/1gFK8w9gR2;2026-05-09 23:25:08;pendente;
