п»ҝid_shopee;produto;preco;comissao_rs;vendas;nota;link_foto;link_afiliado;data_geracao;status;id_instagram
58209148164;"""рҹҢёрҹ‘—рҹ’ғ Descubra o estilo! Conjunto Kimono Plus Size Moda Casual 48 ao 54 Premium, confortГЎvel e charmoso, perfeito para qualquer ocasiГЈo! рҹ’ғрҹҸ»рҹ‘— PreГ§o especial: R$ 175,9! рҹӨ‘ Comente EU QUERO que te envio o link! рҹ’¬""";175.9;5.28;0;0;https://cf.shopee.com.br/file/br-11134207-820lu-mnbk1hfw8dtt34;https://s.shopee.com.br/1qYkLF9365;2026-05-09 23:25:08;pendente;
56951269049;"""PeГ§a o seu organizador de cozinha suspenso modular com prateleira dupla de asfalto e porta 65cm agora mesmo! рҹҡЁ рҹ”Ҙ R$ 79,9 Г© um preГ§o incrГӯvel para um produtos tГЈo Гәtil! рҹҚірҹ’Ә NГЈo perca tempo, compre agora e tenha uma cozinha mais eficiente! рҹҸ  Comente EU QUERO que te envio o link! рҹ“І""";79.9;7.19;1240;4.9;https://cf.shopee.com.br/file/cn-11134207-820l4-mgzz4re29ybw53;https://s.shopee.com.br/1LcTkKAx70;2026-05-09 23:25:08;pendente;
18499668742;"""рҹҚірҹ‘ЁвҖҚрҹҚі COZINHE COM FГҒCILIDADE E SABOR! рҹӨӨ Jogo de 13 peГ§as perfuradas, incluindo panela de pressГЈo 2L e frigideira caГ§arola teflon antiaderente, perfeito para qualquer cozinha! рҹҸ  PreГ§o incrГӯvel: R$ 179,99! рҹӨ‘ Comente EU QUERO que te envio o link!""";179.99;32.40;867;4.6;https://cf.shopee.com.br/file/br-11134207-820ll-mlw8e6mhslc068;https://s.shopee.com.br/2g7sBEqIn1;2026-05-10 12:09:05;pendente;
19598793518;"""Descubra a liberdade de carregar em qualquer lugar com o nosso Carregador PortГЎtil Power Bank Favo de Mel Bateria Externa 20000mah, com capacidade de carga extra e design elegante! рҹ’Ўрҹ“Ҳ PreГ§o incrГӯvel: R$ 44,5! рҹӨ‘ Comente EU QUERO que te envio o link! рҹ’¬""";44.5;4.00;1292;4.8;https://cf.shopee.com.br/file/sg-11134201-81zw6-mivb0umykmbl61;https://s.shopee.com.br/5ApD9pgmiW;2026-05-10 12:09:05;pendente;
19697811379;рҹҡЁ Oferta incrГӯvel! рҹҡЁ CalГ§a pantalona cintura alta com bolso dunas perfeita para o seu estilo! рҹӨ© Com confort e elegГўncia, ela estГЎ Г  venda por apenas R$ 27.92! рҹӨ‘ NГЈo perca essa oportunidade de se vestir bem sem gastar o mundo! рҹҢҺ Comente EU QUERO que te envio o link! рҹ‘ү;27.92;4.47;1574;4.8;https://cf.shopee.com.br/file/br-11134207-820lc-mnvlqciq89he50;https://s.shopee.com.br/50VmxWhQ3V;2026-05-10 12:09:05;pendente;
22394499156;Descubra a facilidade de usar a Seringa Insulina Sr 0.5ml com agulha fixa de 0.25mm, ideal para pessoas com diabetes, com capacidade de 0.5 mL e preГ§o acessГӯvel de R$ 49,9! рҹ“Ұрҹ’үрҹ‘Қ Comente EU QUERO que te envio o link!;49.9;10.98;282;4.9;https://cf.shopee.com.br/file/br-11134207-81z1k-mgza8wp493wg7a;https://s.shopee.com.br/4qCMlDi3OU;2026-05-10 12:09:05;pendente;
19899844544;"""Cozinha perfeita, sem drama! рҹҚірҹ‘ЁвҖҚрҹҚі Adquira agora nossas 12 peГ§as de utensГӯlios de cozinha em silicone, com cabo de madeira e decoraГ§ГЈo livre, 100% BPA! рҹ’ҡ PreГ§o incrГӯvel: R$ 24,99! рҹӨ‘ Comente EU QUERO que te envio o link! рҹ‘Ү""";24.99;3.25;3092;4.8;https://cf.shopee.com.br/file/br-11134207-7r98o-mcu9hg9lje2pb4;https://s.shopee.com.br/4fswYuigjT;2026-05-10 12:09:05;pendente;
58251577343;"""Churrasco em casa como um campeГЈo! рҹҸҶ Compre o Kit Linha Churrasco Casa Flamengo Oficial e apresente a sua comida Г  famГӯlia e amigos com estilo e sabor! рҹҚ–пёҸрҹ”Ҙ R$ 59.99, um preГ§o incrГӯvel! рҹ’ё Comente EU QUERO que te envio o link! рҹ“І""";59.99;4.20;19;4.9;https://cf.shopee.com.br/file/br-11134207-81z1k-mihlslkh1on7be;https://s.shopee.com.br/7VD8GI3nmj;2026-05-10 17:02:47;pendente;
18997974535;"""Acaba a rotina com um toque de luxo! Jogo de 6 taГ§as vidro Diamond Bico Jaca Abacaxi, perfeito para ГЎgua, vinho tinto e sucos, por apenas R$ 14,89! рҹҚёрҹҘӮрҹҚ№ Comente EU QUERO que te envio o link! рҹ’Ў""";14.89;1.94;1114;4.9;https://cf.shopee.com.br/file/br-11134207-820lp-mldnylumwikm80;https://s.shopee.com.br/7fWYSb3ARm;2026-05-10 17:02:47;pendente;
12823128886;"""Acabe com a fadiga e aumente o treino! рҹҸӢпёҸвҖҚвҷӮпёҸрҹ”Ҙ A Creatina em CГЎpsulas Hardcore da Integralmedica Г© 100% pura e monohidratada, perfeita para atletas e treinadores! рҹ’Ә Com 60 cГЎpsulas e um preГ§o incrГӯvel de R$ 27, nГЈo perca a oportunidade de melhorar seus resultados! рҹҡҖ Comente EU QUERO que te envio o link! рҹ“І""";27;3.51;2255;4.9;https://cf.shopee.com.br/file/sg-11134201-7renj-m2ckuwis1x9y28;https://s.shopee.com.br/7ppyeu2X6p;2026-05-10 17:02:47;pendente;
23994136154;"""рҹҡЁ Oferecemos o Conjunto 3 Tapete Jogo de Banheiro Antiderrapante 3 PeГ§as Luxo Felpa Aveluda Com Soladado por apenas R$ 19.99! рҹӨҜ Felpa aveludada, solado e antiderrapante para um banheiro seguro e luxuoso! рҹӣҖ NГЈo perca essa oportunidade incrГӯvel! Comente EU QUERO que te envio o link! рҹ’Ҙ""";19.99;2.60;1278;4.7;https://cf.shopee.com.br/file/br-11134207-7r98o-maa6ayxtl3na70;https://s.shopee.com.br/6fe1Gl6yTc;2026-05-10 17:02:47;pendente;
22795508443;"""Surpreenda a sua mГЈe com o presente perfeito! рҹҺҒ Kit Panelas de Barro Capixaba P, M e G (1L, 2L e 5L) + 2 Cumbucas, original e com garantia, por apenas R$ 178! рҹӨ© NГЈo perca essa oportunidade incrГӯvel para celebrar o Dia das MГЈes com amor e cuidado! Comente EU QUERO que te envio o link! рҹ“І""";178;17.80;180;4.9;https://cf.shopee.com.br/file/br-11134207-81ztc-mjfxndy75zwid1;https://s.shopee.com.br/6pxRT46L8f;2026-05-10 17:02:47;pendente;
22192792890;"""рҹ”ҘрҹҚ–пёҸ Preparo perfeito para o seu churrasco! рҹ”Ҙрҹ‘Ҡ Faca para churrasco profissional luxo personalizado, com qualidade garantida e preГ§o incrГӯvel de R$ 64! рҹӨ‘ Sua equipe merece o melhor, nГЈo Г©? рҹ’Ә Comente EU QUERO que te envio o link! рҹ‘ү""";64;6.40;583;4.9;https://cf.shopee.com.br/file/br-11134207-81z1k-mfyfc5895i4l55;https://s.shopee.com.br/9ALMflliCc;2026-05-10 23:27:27;pendente;
56009775284;"""VocГӘ Г© um fГЈ de futebol? Compre o ГҒlbum Copa Do Mundo Oficial Panini Fifa 2026, com capa mole e 112 pГЎginas de histГіria e detalhes incrГӯveis! Гү a coleГ§ГЈo oficial e licenciada do Fifa, perfeito para qualquer torcedor! PreГ§o especial de R$ 46,99! Comente EU QUERO que te envio o link! рҹҸҶрҹ“ҡрҹҺү""";46.99;7.52;88;4.9;https://cf.shopee.com.br/file/br-11134207-820lp-mnp0aku01gxta6;https://s.shopee.com.br/901wTSmLXb;2026-05-10 23:27:27;pendente;
23793877414;"""Descubra o estilo feminino com o conjunto Lanzinha Ribi canelada 2 PeГ§as Blusa e Pantalona plus size! рҹҢёрҹ‘— Perfeito para qualquer ocasiГЈo, com preГ§o incrГӯvel: R$ 79,99! рҹ’ё NГЈo perca essa oportunidade de se sentir linda e confortГЎvel, Comente EU QUERO que te envio o link! рҹ“І""";79.99;5.60;4083;4.9;https://cf.shopee.com.br/file/br-11134207-7r98o-m8chfe68zv1te0;https://s.shopee.com.br/9UyD4NkRWi;2026-05-10 23:27:27;pendente;
22097760112;"""Descubra o conforto para o seu melhor amigo! рҹҗҫрҹ’Ө Cama Pet Nuvem Inverno Gigante Redonda 60x60cm PET, o lugar perfeito para o seu pet dormir em um sonho, por apenas R$ 27! рҹӣҚпёҸ Comente EU QUERO que te envio o link! рҹ“І""";27;4.59;213;4.4;https://cf.shopee.com.br/file/br-11134207-81z1k-mfe28l5ec7pg1c;https://s.shopee.com.br/9Kems4l4rh;2026-05-10 23:27:27;pendente;
22793917445;"""рҹҚірҹ‘Җ Descubra a mini frigideira panquequeira divertida com figuras divertidas! рҹ’Ҙ FaГ§a panqueques em forma de ometele, tapioca e mais! рҹӨ© PreГ§o incrГӯvel: R$ 19,9! рҹӨ‘ Comente EU QUERO que te envio o link! рҹ‘ү""";19.9;2.98;468;4.6;https://cf.shopee.com.br/file/sg-11134201-7rens-m8p51u0jjmhu9d;https://s.shopee.com.br/9pb3SzjAqo;2026-05-10 23:27:27;pendente;
48909851613;"""VocГӘ estГЎ pronto para a Copa do Mundo? рҹҸҶрҹҢҺ ConheГ§a o Album Capa Mole Brochura E Figurinhas Copa Do Mundo FIFA 2026 Original Panini, com preГ§o incrГӯvel de R$ 56.99 рҹӨ‘! Com mais de 500 figurinhas de jogadores e times, Г© o seu passaporte para a paixГЈo! рҹҺү Comente EU QUERO que te envio o link! рҹ“І""";56.99;15.96;70;5;https://cf.shopee.com.br/file/br-11134207-820ln-mnu6iaydut4w0a;https://s.shopee.com.br/2g7ttx659R;2026-05-11 14:03:00;pendente;
58205089161;"""Desperte seu cafГ© da manhГЈ com estilo! рҹҢһрҹҘҗ Kit Mesa Posta Glamour 11 PeГ§as: jarra, queijeira, manteigueira, aГ§ucareiro, boleira e mais 5 acessГіrios para uma apresentaГ§ГЈo perfeita! рҹҺү R$ 69,35 - Гү tempo de brilhar! рҹҢҹ Comente EU QUERO que te envio o link! рҹ’•""";69.35;6.93;16;4.5;https://cf.shopee.com.br/file/br-11134207-81zuh-mkmgscpcvw1sa5;https://s.shopee.com.br/3B4AUs4B8Y;2026-05-11 14:03:00;pendente;
58256977961;"""Completa sua coleГ§ГЈo de figurinhas da Copa Caixa com essa porta de 100 figurinhas de bolso para album! рҹҸҶрҹҺү PreГ§o incrГӯvel de R$ 23,34! рҹ’ё Agora vocГӘ pode organizar e proteger suas minhas mais valiosas, Г© uma escolha imperdГӯvel para todos os coleccionadores! рҹӨ© Comente EU QUERO que te envio o link! рҹ‘ү""";23.34;4.20;393;4.9;https://cf.shopee.com.br/file/br-11134207-820m0-mlv4h96f6x3adc;https://s.shopee.com.br/30kkIZ4oTX;2026-05-11 14:03:00;pendente;
58257935434;"""EstГЎ pronto para a Copa do Mundo?! рҹҸҶрҹҺү Compre agora o Copo Termico 473ml Personalizado Brasil com Abridor integrado e Tampa e brinde com estilo! рҹҚә R$ 42,2 Г© um preГ§o inacreditГЎvel! рҹӨ‘ Comente EU QUERO que te envio o link! рҹ‘ү""";42.2;7.60;69;5;https://cf.shopee.com.br/file/br-11134207-820lu-mmiv5l9yvbwne0;https://s.shopee.com.br/7KtjSWoJgO;2026-05-11 14:03:00;pendente;
58257248647;"""Prepare-se para conquistar a Copa com estilo! рҹҸҶрҹ‘• Camiseta do Brasil com personagem e nГәmero 10, perfeita para quem nГЈo se segura para gritar ""OlГ©!"" рҹҺү! R$ 39, um preГ§o incrГӯvel para um item que vai fazer vocГӘ se destacar no estГЎdio! рҹҳҺ Comente EU QUERO que te envio o link! рҹ‘ү""";39;7.41;53;4.8;https://cf.shopee.com.br/file/sg-11134201-8260x-mm25zpplzrpc71;https://s.shopee.com.br/7VD9epngLR;2026-05-11 14:03:00;pendente;
23493478982;"""Descubra a hidrataГ§ГЈo perfeita com o KIT Lili! рҹҢёрҹҢ» Creme e perfume acetinado para corpo e mГЈos que cuida e amacia a pele, com apenas R$ 49,15! рҹӣҚпёҸрҹ‘Ң Comente EU QUERO que te envio o link! рҹ’–""";49.15;1.47;1270;4;https://cf.shopee.com.br/file/sg-11134201-7rdy2-m1gckdbobbcta0;https://s.shopee.com.br/qgFypIcdb;2026-05-11 17:59:32;pendente;
23893965494;"""Desperte para um cafГ© perfeito e um lanche delicioso com o Kit CafГ© ManhГЈ Chaleira ElГ©trica + Sanduicheira 127v ou 220v do Kian! рҹҚөрҹҚһ Melhore a sua rotina matinal com essa oferta incrГӯvel por apenas R$ 156.99! рҹӨ‘ Comente EU QUERO que te envio o link! рҹ”—""";156.99;59.66;46;4.6;https://cf.shopee.com.br/file/br-11134207-81z1k-mhv1vovemm8355;https://s.shopee.com.br/4LG89G5IXI;2026-05-11 17:59:32;pendente;
22791524466;"""Adicione um toque de luxo ao seu quarto com o Tapete Peludo Felpudo 2,00 x 1,40 Mt, perfeito para sala ou quarto, com preГ§o incrГӯvel de R$ 56.89! рҹӣӢпёҸрҹҸ рҹ‘Қ Comente EU QUERO que te envio o link! рҹ’ё""";56.89;7.40;816;4.8;https://cf.shopee.com.br/file/br-11134207-7r98o-m5t2gkv0kyb683;https://s.shopee.com.br/4VZYLZ4fCL;2026-05-11 17:59:32;pendente;
27968827694;"""Obtenha a tГЎbua de corte mais segura e higiГӘnica do mercado! рҹҡЁ A TГЎbua De Corte 304 AГ§o InoxidГЎvel Antibacteriana ГҖ Prova De Mofo 46 cm Г© a soluГ§ГЈo perfeita para a sua cozinha, com superfГӯcie resistente e fГЎcil de limpar! рҹ’Ә PreГ§o incrГӯvel: R$ 28.99! рҹӨ‘ Comente EU QUERO que te envio o link!""";28.99;2.03;6342;4.7;https://cf.shopee.com.br/file/cn-11134207-7ras8-m31syvxotyp390;https://s.shopee.com.br/40dHke6ZDG;2026-05-11 17:59:32;pendente;
25248011033;"""Desfrute da moda e do confort! Encontre a perfeiГ§ГЈo com nossas botas femininas cano longo enrugado salto bloco bico fino, original e de alta qualidade, por apenas R$ 149,9! рҹҢҹрҹ‘ рҹ”Ҙ Comente EU QUERO e te envio o link! рҹ‘ү""";149.9;10.49;1726;4.9;https://cf.shopee.com.br/file/br-11134207-820lu-mlgfi3ahmsqs7a;https://s.shopee.com.br/4Awhwx5vsJ;2026-05-11 17:59:32;pendente;
26830891279;"""рҹ”Ҙрҹ“ә Obtenha a melhor experiГӘncia de entretenimento em casa com o Projetor WiFi de lanГ§amento portГЎtil e Android HDMI Smart Theater Hy3004kHD! рҹ“ұрҹҺҘ Com qualidade de imagem 4K, conexГЈo Wi-Fi e controle remoto, vocГӘ pode assistir filmes, jogar games e fazer apresentaГ§Гөes em qualquer lugar! рҹҢҗ PreГ§o incrГӯvel de R$ 186,99! рҹӨ‘ Comente EU QUERO que te envio o link!""";186.99;18.70;66;4.6;https://cf.shopee.com.br/file/sg-11134201-7rdw9-mc1xdu8h75n202;https://s.shopee.com.br/9fHero9OGw;2026-05-11 23:30:48;pendente;
54653322708;"""Limpeza profissional em casa com o Haosin AГ§o inoxidГЎvel Mop GiratГіrio EsfregГЈo 2 Refis! рҹ§№рҹ’Ә Cesto giratГіrio e cabo de 140cm garantem uma limpeza eficiente e fГЎcil! рҹҡ®рҹ’Ұ PreГ§o incrГӯvel de R$39,9! рҹӣҚпёҸ Comente EU QUERO que te envio o link! рҹ‘ү""";39.9;3.99;5845;4.6;https://cf.shopee.com.br/file/cn-11134207-820l4-mi76s7xi2y9t86;https://s.shopee.com.br/9pb5478kvz;2026-05-11 23:30:48;pendente;
23998904144;"""Surpreenda sua mГЈe especial com uma caneca personalizada com seu nome! рҹҺҒрҹ‘ө Dia das MГЈes estГЎ aГӯ! Se escreve MГғE... e Г© tudo! рҹҳҚ R$ 28,41 - Comente EU QUERO que te envio o link! """;28.41;3.41;188;4.8;https://cf.shopee.com.br/file/sg-11134201-824id-mesm65771ts2ef;https://s.shopee.com.br/9zuVGQ87b2;2026-05-11 23:30:48;pendente;
19699326661;рҹ’Ҙ Alimente seu corpo, nГЈo seu bolso! рҹҸӢпёҸвҖҚвҷҖпёҸ Kit 24 unidades de potes de alimentaГ§ГЈo para freezer, microondas e fitness, perfeito para refeiГ§Гөes rГЎpidas e saudГЎveis! рҹҘ— PreГ§o incrГӯvel de R$ 13.99! рҹ‘ү Comente EU QUERO que te envio o link!;13.99;1.82;868;4.9;https://cf.shopee.com.br/file/br-11134207-7r98o-mbh6pvptj2zm83;https://s.shopee.com.br/AADvSj7UG5;2026-05-11 23:30:48;pendente;
23498101067;"""QUEIMA DE ESTOQUE! рҹ’Ҙ ArmГЎrio Espelheira com Porta Cleo em vГЎrias cores рҹ”Ҙ com preГ§o incrГӯvel de R$ 129.99! рҹӨ‘ NГЈo perca essa oportunidade de transformar sua casa em estilo e economia! Comente EU QUERO que te envio o link!""";129.99;15.60;3868;4.8;https://cf.shopee.com.br/file/br-11134207-7r98o-m4eljltmyhj51f;https://s.shopee.com.br/AKXLf26qv8;2026-05-11 23:30:48;pendente;
58209096981;"""Descubra a beleza da Floratta Red! рҹ’ғрҹҸ»вқӨпёҸ Perfume intenso e sedutor, perfeito para quem gosta de se sentir confiante e atraente. R$ 19.99 Г© um preГ§o imperdГӯvel! рҹҡҖ Comente EU QUERO que te envio o link! рҹ“І""";19.99;2.60;2;5;https://cf.shopee.com.br/file/br-11134207-820lf-mn5xmp7ki3us93;https://s.shopee.com.br/7pq1bPl6Sf;2026-05-12 13:20:26;pendente;
58006470123;"""VocГӘ estГЎ preparado para a Copa do Mundo 2026? вҳҖпёҸрҹҸҶ Estamos lanГ§ando o Conjunto Brasil cropped Canelado e short, perfeito para o verГЈo e para mostrar sua paixГЈo pela seleГ§ГЈo! рҹҮ§рҹҮ· PreГ§o: R$ 34,9! рҹӨ‘ Comente EU QUERO que te envio o link! рҹ’Ҙ""";34.9;2.79;274;4.7;https://cf.shopee.com.br/file/sg-11134201-8260k-ml5sziol6dqn9e;https://s.shopee.com.br/7Ktl0Un0Ta;2026-05-12 13:20:26;pendente;
23893450569;"""Kit de 2 Moletom Canguru com Capuz e Bolso sem Estampa Liso Unissex, perfeito para homens e mulheres! рҹҢһрҹ‘•рҹ‘— Agora vocГӘ pode se vestir para qualquer ocasiГЈo com estilo e conforto, tudo por apenas R$ 115,90! рҹ’ёрҹ‘Ң Comente EU QUERO que te envio o link! рҹ“І""";115.9;15.07;1158;4.9;https://cf.shopee.com.br/file/br-11134207-81z1k-mfe3ofqdr18gd5;https://s.shopee.com.br/7VDBCnmN8d;2026-05-12 13:20:26;pendente;
50755364333;"""Acabe com a dor da queimadura voadora рҹҡҖ! Desbloqueie seu potencial com nossos tГӘnis de corrida profissionais рҹҸғвҖҚвҷӮпёҸ, equipados com palma completa, placa de carbono e tecnologia PB IZHC NOKS рҹ’Ә! PreГ§o incrГӯvel: R$ 88,88! Comente EU QUERO que te envio o link! рҹ‘ү""";88.88;8.00;438;4.7;https://cf.shopee.com.br/file/sg-11134201-82611-mjyebkok1gxzdc;https://s.shopee.com.br/70GubsoH9Y;2026-05-12 13:20:26;pendente;
20420779647;"""Churrasqueira a Bafo PortГЎtil para Pescaria Viagens Camping Material Resistente! рҹҚ”рҹҢҙ PrГЎtica, leve e fГЎcil de usar, Г© perfeita para suas aventuras ao ar livre! рҹҸһпёҸрҹ‘Қ PreГ§o incrГӯvel: R$ 79,99! рҹӨ‘ Comente EU QUERO que te envio o link! рҹ‘ү""";79.99;5.60;778;4.7;https://cf.shopee.com.br/file/br-11134207-7r98o-mc55mc5rhodjb3;https://s.shopee.com.br/7AaKoBndob;2026-05-12 13:20:26;pendente;
22092998564;"""Quer ganhar massa muscular em pouco tempo? рҹҸӢпёҸвҖҚвҷӮпёҸрҹ”Ҙ A Creatina Monohidratada Pura de 1kg de Dark Lab Г© a soluГ§ГЈo ideal para vocГӘ! рҹҢҹ Com 74,9 reais vocГӘ ganha mГәsculos rГЎpidos e seguros, sem custo elevado! рҹ’ё Comente EU QUERO que te envio o link!""";74.9;14.23;13566;4.9;https://cf.shopee.com.br/file/br-11134207-7r98o-lzawb2jf7rxhf2;https://s.shopee.com.br/Lk0z9d5yC;2026-05-12 18:04:44;pendente;
23294058392;"""Kit de 10 cuecas masculinas de microfibra com forro 100% algodГЈo, cores variadas e preГ§o incrГӯvel de R$ 28,9! рҹӣҚпёҸрҹ‘•рҹ’ё Comente EU QUERO que te envio o link! рҹ‘ү""";28.9;5.20;7458;4.6;https://cf.shopee.com.br/file/br-11134207-81z1k-mggo5nxqp1xgb1;https://s.shopee.com.br/W3RBScSdF;2026-05-12 18:04:44;pendente;
22498206838;"""рҹҡЁ Oferta imperdГӯvel! вңЁ Encontre o conforto perfeito com nossos tГӘnis brancos casual femininos, com plataforma de borracha e sola pintada! рҹ’… PreГ§o incrГӯvel: R$ 49,80! рҹ”Ҙ Comente EU QUERO que te envio o link! рҹ“І""";49.8;8.96;691;4.9;https://cf.shopee.com.br/file/br-11134207-81ztc-mj7ugq1t7qpv96;https://s.shopee.com.br/17AaXeMeA;2026-05-12 18:04:44;pendente;
20698271319;"""Acerte o look do inverno com o Conjunto Ziper Inverno Pantalona! рҹҚӮрҹ‘– PreГ§o incrГӯvel de R$ 70! рҹҳҚ Tamanho Гәnico e estampa exclusiva para quem quer se destacar! рҹҢҹ Comente EU QUERO que te envio o link! рҹ‘ү""";70;9.10;0;3.4;https://cf.shopee.com.br/file/br-11134207-7r98o-mcv0e8i3x5vl56;https://s.shopee.com.br/BQamqdjJD;2026-05-12 18:04:44;pendente;
58250576005;"""рҹҸ рҹ’јрҹ‘  Organize sua vida com a Sapateira Vertical! рҹҡҖ Com portas organizadoras e multiuso, decore sua sala, quarto ou entrada e aproveite o espaГ§o de forma eficiente! рҹӨ© PreГ§o incrГӯvel: R$ 153,87! рҹҺҒ Comente EU QUERO que te envio o link! рҹ’¬""";153.87;10.77;2633;4.4;https://cf.shopee.com.br/file/br-11134207-81z1k-mgzllpwzxa13d1;https://s.shopee.com.br/10zhmNaYcO;2026-05-12 18:04:44;pendente;
58208908770;"""Descubra o seu nГӯvel de saГәde com nosso kit completo de monitoramento mГ©dico! рҹӨ– Medidor de pressГЈo arterial digital, tensiГҙmetros, termГҙmetro infravermelho e oxГӯmetro de dedo para uma avaliaГ§ГЈo total da sua saГәde em apenas um momento! рҹ’Ҝ PreГ§o incrГӯvel R$ 74,99! рҹҡҖ Comente EU QUERO que te envio o link!""";74.99;9.75;1557;4.9;https://cf.shopee.com.br/file/sg-11134201-81zvb-mn36o785y4g0a4;https://s.shopee.com.br/1Vvyk6Q17A;2026-05-12 23:36:47;pendente;
58210082441;"""Viva a Copa do Mundo 2026! рҹҸҶрҹҢҺ ConheГ§a a nossa promoГ§ГЈo incrГӯvel: Kit Figurinha para ГҒlbum com todas as seleГ§Гөes participantes e personagens exclusivos! рҹҺү PreГ§o acessГӯvel de R$ 39,99! рҹӨ‘ NГЈo perca a chance de colecionar as suas seleГ§Гөes favoritas e mostrar a sua paixГЈo pelo futebol! Comente EU QUERO que te envio o link! рҹ’¬""";39.99;6.80;19;4.5;https://cf.shopee.com.br/file/br-11134207-820m4-mnubtil43r417d;https://s.shopee.com.br/1LcYXnQeS9;2026-05-12 23:36:47;pendente;
23797414268;"""Protija-se ao sol e ao outdoor com nossa camisa de pesca camping agro com proteГ§ГЈo UV e bolsa personalizada, perfeita para o Brasil, com preГ§o incrГӯvel de R$ 54,90! рҹҢһрҹҺЈрҹҸ•пёҸ Comente EU QUERO que te envio o link! рҹ‘ү""";54.9;9.88;210;4.9;https://cf.shopee.com.br/file/br-11134207-81z1k-mhqbqr1rijurd9;https://s.shopee.com.br/1qYp8iOkRG;2026-05-12 23:36:47;pendente;
58259040527;"""рҹҸҶрҹҺү EstГЎ pronto para a Copa do Mundo 2026?! рҹӨ© Coletar figurinhas nunca foi tГЈo divertido! рҹҺҒ Compre agora a caixa porta figurinhas que cabem 500 peГ§as e tenha a garantia de nГЈo perder nenhuma! рҹ“Ұ PreГ§o incrГӯvel: R$ 39,69! рҹӨ‘ Comente EU QUERO que te envio o link!""";39.69;9.13;78;4.6;https://cf.shopee.com.br/file/br-11134207-820me-mncrzmofqsxw11;https://s.shopee.com.br/1gFOwPPNmF;2026-05-12 23:36:47;pendente;
7091896650;"""VocГӘ quer ganhar dinheiro rГЎpido e fГЎcil? Revenda os 200 Adesivos de Unhas Copa Brasil Atacado por apenas R$ 22 e obtenha lucro com nossa estratГ©gia de marketing! рҹҸҶрҹ’…рҹҡҖ Comente EU QUERO que te envio o link!""";22;0.66;13;4.8;https://cf.shopee.com.br/file/br-11134207-820l8-mlgoyi7m74ee1a;https://s.shopee.com.br/2BBfXKNTlM;2026-05-12 23:36:47;pendente;
22897613591;"""OfereГ§a conforto e calor a vocГӘ e a seu amor com o Cobertor Sherpa Casal Grossa! рҹҚҒрҹҸ пёҸ Com 2,20x1,80m e vГЎrias cores disponГӯveis, Г© o item perfeito para o inverno! рҹҘ¶ PreГ§o incrГӯvel de R$ 69,9! рҹӨ‘ Comente EU QUERO que te envio o link!""";69.9;2.10;2771;4.7;https://cf.shopee.com.br/file/br-11134207-820m9-mmj88ilbdddsab;https://s.shopee.com.br/2BBgSyoRfO;2026-05-13 13:36:18;pendente;
58255626835;"""Vem proteger seu corpo do frio com o nosso kit 2 em 1 рҹҢЎпёҸ: 2 moletons de frio ou uma uni com zГӯper e capuz bolso jaqueta casaco blusa! PreГ§o incrГӯvel: R$ 68,4! рҹҺҒ NГЈo perca essa oportunidade! Comente EU QUERO que te envio o link! рҹҳҠ""";68.4;8.89;101;4.8;https://cf.shopee.com.br/file/br-11134207-81zun-ml17b16zej9d19;https://s.shopee.com.br/20sGGfp50N;2026-05-13 13:36:18;pendente;
51208066379;"""Lavagem automotiva perfeita sГі com nosso Kit 10 PeГ§as! рҹҡ—рҹ’Ұ Esponja + Escova de Pneu + Flanela + Aplicador de Cera + Luva Microfibra + Kit Pincel para um acabamento impecГЎvel рҹҢҹ PreГ§o incrГӯvel R$ 37,99! рҹҡҖ Comente EU QUERO que te envio o link! рҹ‘ү""";37.99;3.04;292;4.8;https://cf.shopee.com.br/file/cn-11134207-820l4-mnf78jq500lh44;https://s.shopee.com.br/1qYq4MpiLM;2026-05-13 13:36:18;pendente;
22994846872;"""рҹҚірҹ‘ЁвҖҚрҹҚі OfereГ§a a sua cozinha uma organizaГ§ГЈo total com o kit 21 potes que inclui tudo o que vocГӘ precisa para armazenar ingredientes e utensГӯlios! рҹӨ© PreГ§o incrГӯvel de R$ 39,99! рҹҺү Comente EU QUERO que te envio o link! рҹ“І""";39.99;9.20;923;4.7;https://cf.shopee.com.br/file/br-11134207-81ztj-mku1w5yl9fk3a7;https://s.shopee.com.br/1gFPs3qLgL;2026-05-13 13:36:18;pendente;
23799391942;"""Acabei de encontrar o seu novo perfume favorito! рҹҢёрҹ’• Body Splash Feminino Ameixa Negra 200ml, um doce e marcante perfume para uso diГЎrio que vocГӘ nГЈo pode perder! рҹӨ© PreГ§o incrГӯvel de R$ 26,9! рҹ“Ҳ Comente EU QUERO que te envio o link! #perfumefeminino #ameixanegra #body splash""";26.9;2.69;231;4.8;https://cf.shopee.com.br/file/br-11134207-820lw-mm66pv5qo9hi5b;https://s.shopee.com.br/1Vvzfkqz1K;2026-05-13 13:36:18;pendente;
