id_shopee;produto;preco;comissao_rs;vendas;nota;link_foto;link_afiliado;data_geracao;status;id_instagram
22892865290;"""Descubra a magia de imprimir fotos de desenhos animados em qualquer lugar com a nossa Mini Impressora Portátil de Impressão Sem Fio! 🎨🖨️ Perfeito para crianças e adultos, ela é compatível com Android e iOS e é disponível por apenas R$ 47,9! 📈👉 Comente EU QUERO que te envio o link! 📲""";47.9;5.75;728;4.9;https://cf.shopee.com.br/file/br-11134207-7r98o-lsaj0iwu4y78f0;https://s.shopee.com.br/30j1oV9C74;2026-03-05 19:46:47;pendente;
23198789124;"""🍴👌 Acaba com a sujeira dos pratos sem esforço com nossos kits de panos de prato atoalhados! 🚨 Preço incrível: R$ 32,5! 📦 100% algodão e estampados lindos! 🎉 Kit com 10 panos! 🤩 Comente EU QUERO que te envio o link! 💕""";32.5;5.20;854;4.6;https://cf.shopee.com.br/file/sg-11134201-7rdvk-md0wbc3wep4n07;https://s.shopee.com.br/7fUreu2qNx;2026-03-06 00:06:22;pendente;
23694153615;"""Transforme sua noite de cinema em uma experiência inesquecível com a Pipoqueira Elétrica Ar Quente Máquina Fazer Pipoca Sem Óleo 110V! 🍿🍫 Fácil de usar, sem óleo e com resultado incrível, ela é a solução perfeita para quem busca um lanche saudável e delicioso! 🤤 R$ 68,99 é um preço incrível para essa máquina incrível! 🤑 Comente EU QUERO que te envio o link! 📲""";68.99;8.97;533;4.8;https://cf.shopee.com.br/file/sg-11134201-7rats-mb0gxhhlgbwxc5;https://s.shopee.com.br/7VBRSb3Tiw;2026-03-06 00:06:22;pendente;
23898100561;"""Desbloqueie o conforto e a produtividade com nossa mesa de apoio lateral para sofá cama, perfeita para trabalhar com seu notebook portátil, feita de base de ferro e MDF, com preço incrível de R$ 59,97! 🛋️💻 Comente EU QUERO que te envio o link! """;59.97;7.80;3856;4.8;https://cf.shopee.com.br/file/br-11134207-7r98o-m50ee5ecvvps6e;https://s.shopee.com.br/7Ks1GI473v;2026-03-06 00:06:22;pendente;
23793045074;"""🍲👌 Proteja a saúde do seu reino culinário com o Kit de 5 ou 10 Potes Vidro Hermético de 450ml Retangular Marmita Premium! 🚫 Sem químicos, sem corrosão, sem perda de sabor! 😋 Preço incrível: R$ 44,97! 🤑 Comente EU QUERO que te envio o link!""";44.97;5.85;2930;4.9;https://cf.shopee.com.br/file/br-11134207-81ztc-mk2euk37s0eaec;https://s.shopee.com.br/8V3yeQzfhA;2026-03-06 00:06:22;pendente;
14617458808;"""Acabei de encontrar o vestido perfeito para você! 🌸👗 Vestido longo feminino com botão solto e estampa única, perfeito para qualquer ocasião! 🎉 R$ 40,42 é um preço incrível! 💸 Compre agora e seja a rainha do baile! 💃 Comente EU QUERO que te envio o link! """;40.42;10.91;26;4.6;https://cf.shopee.com.br/file/049a03dd37ee70e322c2ca38709d9ce4;https://s.shopee.com.br/8KkYS80J29;2026-03-06 00:06:22;pendente;
23594508364;"""Descubra a beleza e a praticidade com a nossa chaleira luxo vidro borossilicato Âmbar Bule! 🍵🔥 Com design decorativo e capacidade de 1 litro, ela é perfeita para chás, sucos e infusões. Preço incrível: R$ 34,86! 🤑 Comente EU QUERO que te envio o link! 📲""";34.86;4.18;64;4.9;https://cf.shopee.com.br/file/br-11134207-81z1k-mgchphr69bes14;https://s.shopee.com.br/7AYbr8NEVP;2026-03-06 12:02:04;pendente;
22497622314;"""Melhore sua rotina de treino com nosso Conjunto fitness short duplo 3 peças! 💪🏽👕 Duração extra, comodidade e estilo em um só, por apenas R$ 159,90! 🤑 Agora você pode se sentir confiante em qualquer exercício, com a nossa roupa de treino que combina com qualquer look! 🌟 Comente EU QUERO que te envio o link! 📲""";159.9;28.78;105;4.9;https://cf.shopee.com.br/file/br-11134207-7r98o-lx9m6t2rpx33a1;https://s.shopee.com.br/7Ks23RMbAS;2026-03-06 12:02:04;pendente;
23298705909;"""👖 Vem agora! Calça pantalona com corte alfaiaitaria, social e minimalista a R$ 36,63! Estamos de promoção! 🚨 Não perca essa oportunidade de revolucionar seu guarda-roupa com estilo e preço incrível! Comente EU QUERO que te envio o link! 📲""";36.63;6.59;11;4.6;https://cf.shopee.com.br/file/br-11134207-7r98o-mbzwf8lkxcux09;https://s.shopee.com.br/7VBSFkLxpV;2026-03-06 12:02:04;pendente;
23399301760;"""Descubra a Nuvem de Alegria! 🌫️ Com seu toque leve e entusiasmante, este Body Splash te dará a sensação de felicidade em cada borrifada 😊! R$ 19,99 - Um prazer para os sentidos não pode faltar no seu dia a dia! 💦 Comente EU QUERO que te envio o link! 👉""";19.99;2.60;4;5;https://cf.shopee.com.br/file/br-11134207-81z1k-mifz5uwdy0hy48;https://s.shopee.com.br/7fUsS3LKUY;2026-03-06 12:02:04;pendente;
22394074062;"""Corra para a Copa do Mundo vestindo estilo com o Cropped Top Alça Fina Feminino fitness, inspirado na camisa da seleção brasileira Esther Brasil, perfeito para o treino ou para mostrar sua paixão pelo futebol! 🏆🔥 R$ 29,45! 💸 Comente EU QUERO que te envio o link! 💬""";29.45;3.83;255;4.9;https://cf.shopee.com.br/file/br-11134207-7r98o-malkavy65nnd5f;https://s.shopee.com.br/7poIeMKh9b;2026-03-06 12:02:04;pendente;
23999250695;"""Acabou de encontrar o seu novo par de tenis! 🥳 Tenis Unissex Casual modinha com design moderno e super confortável, por apenas R$ 38 🤑! 💺 Não perca essa oportunidade incrível! Comente EU QUERO que te envio o link! 👉""";38;5.70;899;4.9;https://cf.shopee.com.br/file/br-11134207-81ztc-mj4rx7l2q5fnb1;https://s.shopee.com.br/9fFxDyeLex;2026-03-06 17:55:11;pendente;
23994231697;"""👶🏼👕👖 Ofereça os melhores sonhos para o seu bebê com o Kit 5 Pijamas Baby Dool Sortidos SUEDE Personagem! 🤩 Diversão garantida com 5 personagens diferentes, perfeitos para os bebês mais pequenininhos! 🚫 Preço incrível: R$ 29,9! 🎉 Comente EU QUERO que te envio o link! 👇""";29.9;2.99;588;4.4;https://cf.shopee.com.br/file/sg-11134201-7rdvl-mcjdor2fsy1a6c;https://s.shopee.com.br/qeYhkByaG;2026-03-06 17:55:11;pendente;
24818273902;"""🚀👠 Vamos no espaço! Conheça os Sapatos de Buraco Buzz Lightyear Cartoon Slippers de Verão Menina Bebê em Casa, perfeitos para o seu bebê explorar e brincar em casa! 🌞 Preço incrível: R$ 28.99! 🛍️ Comente EU QUERO que te envio o link! 😊""";28.99;2.90;12;4.8;https://cf.shopee.com.br/file/sg-11134201-7rcev-lsruhak2tl2i96;https://s.shopee.com.br/gL8VRCbvF;2026-03-06 17:55:11;pendente;
41406929361;"""Conjunto social e elegante para a mulher evangélica! 🙌🏼👗 Blusa, colete, calça e pantalona em um só e perfeito conjunto, perfeito para o trabalho, a festa ou qualquer ocasião especial! 🎉 Com preço incrível de R$ 59,9! 💸 Não perca essa oportunidade de brilhar! 🌟 Comente EU QUERO que te envio o link! 👉""";59.9;9.58;270;4.5;https://cf.shopee.com.br/file/br-11134207-81ztc-mj8jk09f6rk15d;https://s.shopee.com.br/1BHP6MAhuM;2026-03-06 17:55:11;pendente;
23993493070;"""💅🏻🌸 Kit de 4 esmaltes de unhas risqué em tons de nude cremoso, hipoalergênico e com preço incrível de R$ 14,89! 💸👉 Compre agora e divirta-se criando looks personalizados! 🎨 Comente EU QUERO que te envio o link! 💕""";14.89;1.94;426;4.9;https://cf.shopee.com.br/file/br-11134207-7r98o-mb5882aq30cvdd;https://s.shopee.com.br/10xyu3BLFL;2026-03-06 17:55:11;pendente;
22098678084;"""Ofereça conforto e segurança ao seu bebê com o nosso Canguru Banco De Cintura, que pode acomodar banquinho abraço dianteiro e traseiro, perfeito para a prática de abdominais e exercícios de alongamento para mães! 🏋️‍♀️👶 Preço: R$ 99,9! 🤑 Comente EU QUERO que te envio o link! 👉""";99.9;11.99;263;4.6;https://cf.shopee.com.br/file/sg-11134201-7ra26-mb9unzkrk1yhbf;https://s.shopee.com.br/9UwXPjaaNE;2026-03-06 23:45:34;pendente;
22499056874;"""Ofereça ao seu corpo o cuidado que ele merece! 🏋️‍♂️💆‍♀️ Smartwatch MINI 38MM PRO com monitor de frequência cardíaca do Computador São Paulo - preços inéditos a partir de R$ 69.99, com pronta entrega! 🚀 Comente EU QUERO que te envio o link! 📲""";69.99;9.10;2397;4.8;https://cf.shopee.com.br/file/br-11134207-81z1k-mg4sqr0e5nggcd;https://s.shopee.com.br/9Kd7DQbDiD;2026-03-06 23:45:34;pendente;
23994136154;"""🚨 Oferta Exclusiva! 🔥 Pequenas reformas, grandes economias! 🤑 Conjuntos 3 Tapete Jogo de Banheiro Antiderrapante 3 Peças Luxo Felpa Aveluda Com Soladado Promo por apenas R$ 17.45! 🤯 Não perca essa oportunidade incrível! 💯 Comente EU QUERO que te envio o link! 📲""";17.45;2.27;404;4.7;https://cf.shopee.com.br/file/br-11134207-7r98o-maa6ayxtl3na70;https://s.shopee.com.br/9pZNoLZJhK;2026-03-06 23:45:34;pendente;
23897749215;"""Transforme sua pele em minutos com o Kit Elseve Glycolic Gloss! ✨ Escolha seu kit e descubra a textura lisa e brilhante de sua pele em apenas 1 aplicação! 🌟 R$ 41.9, um preço incrível para uma pele radiante! 💁‍♀️ Comente EU QUERO que te envio o link! 👉""";41.9;2.93;129;4.9;https://cf.shopee.com.br/file/br-11134207-7r98o-lzs4w4i9oopxa5;https://s.shopee.com.br/9fFxc2Zx2J;2026-03-06 23:45:34;pendente;
22493811573;💁‍♀️ Descubra a pele radiante com nosso Kit Skin Care Completo de Limpeza de Pele Profunda! 🔥 R$ 29,9 é um preço incrível para uma limpeza profunda que remove células mortas, acaba com a acne e traz um brilho saudável para sua pele. 🌸 Limpeza, exfoliação e hidratação em um só kit! 😍 Comente EU QUERO que te envio o link! 👉 #KitSkinCare #LimpezaDePele #PeleRadiante;29.9;4.19;203;4.9;https://cf.shopee.com.br/file/br-11134207-7r98o-m76o8y7fz39mac;https://s.shopee.com.br/AACECxY31Q;2026-03-06 23:45:34;pendente;
22491584319;"""🎧👂 Encontre a perfeição auditiva com nosso Fone P47 Headphone Sem Fio Estéreo, com redução de ruídos e tecnologia Bluetooth 5.0 Universal, por apenas R$ 18,26! 📈👍 Comente EU QUERO que te envio o link! 💬""";18.26;1.28;1684;4.7;https://cf.shopee.com.br/file/sg-11134201-7rfg8-m9al6zdk4txt23;https://s.shopee.com.br/7Ks3de0kYC;2026-03-07 11:52:04;pendente;
19897806782;"""Vou te fazer viajar em estilo! 🛫🗺️ Mala GRANDE 40kg de bordo em promoção agora a R$149,9! 🚀 Mala de Viagem Feliz POLIPROPILENO, durável e resistente para todos os seus destinos ❤️ Comente EU QUERO que te envio o link! 👉""";149.9;10.49;99;4.6;https://cf.shopee.com.br/file/br-11134207-7r98o-may2f3iohi8ff8;https://s.shopee.com.br/7VBTpx07DF;2026-03-07 11:52:04;pendente;
22593054672;"""Papete Moleca feminina original Stras Brilho! 🌸💅️ Dê um brilho incrível a sua pele sem sair de casa! 🏠💄 Preço promocional de R$ 49,64! 🤑 Comente EU QUERO que te envio o link!""";49.64;11.91;234;4.9;https://cf.shopee.com.br/file/br-11134207-7r98o-lw6mvh25cccycd;https://s.shopee.com.br/7fUu2FzTsI;2026-03-07 11:52:04;pendente;
21798536968;"""Descubra a beleza da tranquilidade com o KIT 6 Toalhas Turquesa 100% Algodão, perfeito para banho e cuidados de rosto! 🌊💆‍♀️ Compre por R$ 61,9 e sinta a suavidade e confort no seu dia a dia! 🛍️ Comente EU QUERO que te envio o link! 👉""";61.9;8.05;299;4.4;https://cf.shopee.com.br/file/br-11134207-7r98o-md6345hqpy4h6d;https://s.shopee.com.br/7poKEYyqXL;2026-03-07 11:52:04;pendente;
41524476332;"""🍳👨‍🍳 Preparar refeições deliciosas sem gastar uma fortuna! 🤑 Descubra nosso Conjunto de Utensílios de Cozinha de 19 peças (faca, colher e acessórios) completo e essencial para qualquer cozinha 🍴, agora por apenas R$ 20.99! 💸 Comente EU QUERO que te envio o link! 📲""";20.99;1.47;154;4.8;https://cf.shopee.com.br/file/cn-11134207-820l4-mfwauy551hjde3;https://s.shopee.com.br/6fcMqQ3Hu8;2026-03-07 11:52:04;pendente;
21598025720;"""🚴‍♂️ Proteja seu smartphone em qualquer aventura com o suporte bike impermeável! 💦 Duração prolongada, design ergonômico e capa touch, tudo por apenas R$27,8! 📱 Não perca mais tempo, Comente EU QUERO que te envio o link! 👉""";27.8;1.39;3135;4.6;https://cf.shopee.com.br/file/br-11134207-7r98o-m5tqeuxkcj9hac;https://s.shopee.com.br/7Ks3yPqpge;2026-03-07 16:54:32;pendente;
21799836330;"""Transforme sua oficina com essa parafusadeira furadeira de impacto poderosa 🚧, com 2 bateria recarregável sem fio de 48v e maleta completa ✨, tudo isso por apenas R$ 120,9, um preço incrível para um investimento que vai revolucionar seu trabalho! 🚀 Comente EU QUERO que te envio o link! 👉""";120.9;15.72;3292;4.8;https://cf.shopee.com.br/file/sg-11134201-822yt-micgsqcko2rma3;https://s.shopee.com.br/7VBUAiqCLh;2026-03-07 16:54:32;pendente;
23394523519;"""Dormir bem é a chave para um dia incrível! 🌙💤 Descubra o Fini Melatonina 60 Cápsulas, o suplemento de sono de qualidade que te ajuda a relaxar e se sentir bem! 🙏 Compre agora por R$ 54.99 e dê um passo em direção ao sono tranquilo! 😴 Comente EU QUERO que te envio o link!""";54.99;11.55;445;4.9;https://cf.shopee.com.br/file/br-11134207-81z1k-mftu2pib3imd1e;https://s.shopee.com.br/7fUuN1pZ0k;2026-03-07 16:54:32;pendente;
22393823873;"""🐶🥚 Ofereça um presente inesquecível para o seu cãozinho! 🐾 Kit Ovo De Páscoa Patrulha Canina com Pelucia Ao Leite Premium 250g Ovo com Brinquedo 🎁, apenas R$ 49.99! 🚀 Comente EU QUERO que te envio o link! 👉""";49.99;5.50;6;4;https://cf.shopee.com.br/file/sg-11134201-7rd4f-m7934jmkwjtk1c;https://s.shopee.com.br/7poKZKovfn;2026-03-07 16:54:32;pendente;
22893643719;"""Transforme sua cozinha em um espaço limpo e organizado com o nosso escorredor de louça! 💪🏼🧹 Pratos e talheres plásticos de fácil limpeza, por apenas R$ 36,9! 🚀 Comente EU QUERO que te envio o link!""";36.9;2.95;533;4.8;https://cf.shopee.com.br/file/sg-11134201-7ra3b-m5287i8pa8ao55;https://s.shopee.com.br/6fcNBBtN2a;2026-03-07 16:54:32;pendente;
